comment,rating
"mรฌnh mua dรนm chแป, nhแบฏm chแปซng ฤแบกi size mร mua vแป mแบทc vแปซa nhฦฐ in! sแบฝ tiแบฟp tแปฅc แปงng hแป shop",5
Sแบฃn phแบฉm tuyแปt vแปi lแบฏm แบก. Giao hรng nhanh. Gรณi kแปน,5
Chแบฅt lฦฐแปฃng sแบฃn phแบฉm tuyแปt vแปi ฤรณng gรณi sแบฃn phแบฉm chแบฏc chแบฏn shop phแปฅc vแปฅ tแปt,5
"Mรฌnh thรญch cรกch tฦฐ vแบฅn cแปงa shop nรy lฤm, chรกt thรฌ trแบฃ lแปi rแบฅt nhanh dรน lร sรกng hay tแปi luรดn,",5
"sp  ฤแบนp chแบฅt liแปu ok , nรณi chung lร so vแปi giรก tiแปn vแบญy lร ok rแปi ,nhฦฐng cรกi quแบงn cแปงa mรฌnh bแป 1 chรบt lแปi lร bแป rรบt chแป mแบฅt 2 ฤฦฐแปng , mแบฅt ฤแบนp , nhฦฐng k sao bแป qua cho shop ๐ค",5
Hรng Ok,5
"shop ฤรณng gรณi rแบฅt kฤฉ, gรณi lแบงn 2 bแปc luรดn nรชn khi cแบฏt ra mรฌnh cรณ chรบt bแปก ngแป vรฌ quรก kฤฉ, chแบฅt vแบฃi thรฌ ok, nรณi chung lร ฤแบนp.",5
"Chแบฅt lฦฐแปฃng ok, ฤฦฐแปng may chแบฏc chแบฏn, lรชn dรกng cลฉng ฤแบนp, sแบฝ แปงng hแป cรกc mแบซu khรกc cแปงa shop nhรฉ.",5
"chแบฅt vแบฃi thun co giรฃn tแปt, mรu cลฉng ฤแบนp, khรดng quรก chรณi, shop tฦฐ vแบฅn rแบฅt lร nhiแปt tรฌnh luรดn.",5
"Mแปi nhแบญn hรng lร mรฌnh khui ra mแบทc luรดn, chแบฅt vแบฃi tแปt, so vแปi giรก nรy thรฌ vแบซn cรฒn rแบป nhรฉ.",5
"Bแป nรy tฦฐแปng mua vแป mแบทc แป nhร thรดi, nhฦฐng bรน lแบกi mรฌnh mแบทc ฤi chฦกi luรดn vแบซn rแบฅt ฤฦฐแปฃc nhรฉ.",5
"ฤรฃ nhแบญn hรng vร rแบฅt thรญch, vแบฃi rแบฅt ฤแบนp, ฤแบนp hฦกn mรฌnh tฦฐแปng tฦฐแปฃng tแบกi giรก rแบป nรชn hฦกi ฤแบฏn ฤo",5
"Mรฌnh nhแบญn ฤฦฐแปฃc hรng rแปi nhรฉ, ฤแป ฤแบนp lแบฏm shop, vแบฃi cลฉng ฤแบนp nแปฏa, OK OK",5
"Set mแบทc ฤแบนp, ok vแป chแบฅt lฦฐแปฃng vร giรก cแบฃ luรดn nhรฉ, sแบฝ แปงng hแป shop sau nรy.",5
"Set nรy mแบทc lรชn rแบฅt ฤแบนp, chแบฅt vแบฃi mแบทc thoแบฃi mรกi, thun co giรฃn tแปt.",5
"Vแบฃi ok, chแบฅt lฦฐแปฃng tแปt, shop nhiแปt tรฌnh tฦฐ vแบฅn khรกch hรng nแปฏa nรชn rแบฅt thรญch shop nhรฉ.",5
"Mแบทc ngoรi nhรฌn ฤแบนp hฦกn trรชn hรฌnh, form dรกng chuแบฉn hฦกn nแปฏa....",5
"Phรน hแปฃp vแปi mรฌnh lแบฏm, mแบทc rแปng thoแบฃi mรกi, vแบฃi ฤแบนp, giรก rแบป nแปฏa. ok nhรฉ shop",5
"Cรกm ฦกn shop ฤรฃ tฦฐ vแบฅn nhiแปt tรฌnh nhรฉ, mแบทc lรชn rแบฅt ฤแบนp, vแบฃi lแบกi rแบฅt mรกt nแปฏa.",5
"ฤแป ฤแบนp, chแบฅt vแบฃi ok, mแบทc mรกt lแบฏm. sแบฝ แปงng hแป shop lau dรi.......",5
"Mรฌnh mua bแป nรy cแปฉ sแปฃ chรณi quรก nhฦฐng sau khi mแบทc lรชn lแบกi rแบฅt dแป chแปu luรดn nhรฉ, chแบฅt thun mแปm mแบกi rแบฅt dแป mแบทc.",5
"Vแบฃi mแปm ฤแบนp, lรชn form dรกng rแบฅt ok nhรฉ.",5
"Lรชn form nhรฌn ฤแบนp, vแบฃi co giแบฃn tแปt, rแบฅt xแปฉng ฤรกng ฤแป mua.",5
"Chแบฅt lฦฐแปฃng tแปt, form dรกng ok.",5
"Dรกng mรฌnh tฦฐฦกng ฤแปi, nรชn mแบทc vรo thแบฅy rแบฅt ฤแบนp, mร ngแบกi khoe hรฌnh lรชn ฤรขy, kakaka",5
ฤรNG MUA LแบฎM,5
"mรฌnh nhแบญn ฤฦฐแปฃc hรng rแปi nhรฉ, thanks shop ฤรฃ tฦฐ vแบฅn nhiแปt tรฌnh nhรฉ.",5
"Dรกng ฤแป ฤแบนp, vแบฃi co giรฃn tแปt,",5
"Form dรกng ฤแบนp, vแบฃi co giรฃn tแปt, giรก rแบป.",5
"Mรฌnh nhแบญn hรng rแปi, ฤแป rแบฅt ฤแบนp vร ok,",5
Rแบฅt ฤรกng ฤแป mua.,5
"vแบฃi ฤแบนo, dรกng rแปng thoแบฃi mรกi.",5
ฤแบนp lแบฏm shop,5
