comment,rating
"Hรng ฤแบนp, chแบฅt lฦฐแปฃng, tแบฅt cแบฃ mแปi sแบฃn phแบฉm ฤแปu mแปi keng xร beng luรดn nha mแปi ngฦฐแปi ๐",5
Hรng chแบฅt lฦฐแปฃng sแบฃn phแบฉm tแปt. Giรก cแบฃ hแปฃp lรฝ. Nhฦฐng bรชn vแบญn chuyแปn giao hรng hฦกi chแบญm.,5
Nhแบญn hรng ฤรบng mแบซu.chแบฅt ฤแบนp. 1 vรy hฦกi rแปng lฦฐแปi ฤแปi lแบกi chแบฏc phแบฃi sแปญa tรญ mแปi mแบทc ฤc.,5
"sแบฃn phแบฉm cแปงa shop tแบฅt cแบฃ ฤแปu ฤแบนp mแปi ngฦฐแปi nรชn mua ,ฤรขy lร shop ฤรกng tin",5
"Sแบฃm phแบฉm ฤแบนp nhฦฐ hรฌnh, ฤรณng gรณi cแบฉn thแบญn, sแบฝ quay lแบกi mua cแปงa shop nแปฏa แบก",5
"Nhแบญn ฤฦฐแปฃc hรng rแปi ฤแบนp lแบฏm shop nhรฉ vแบญn chuyแปn nhanh, gรณi hรng cแบฉn thแบญn",5
Chแบฅt dรy quรก nรชn hฦกi bแป nรณng..mmmmmmmmmmmmmmmmmmmmmmm,5
ฤแป ฤแบนp xแปฉc sแบฏc :))))))),5
