comment,rating
Mua cแปงa shop nhiแปu rแปi. Nรณi chung lร hรng ok. Gแปญi hรng ok. ฤรณng gรณi ok. Chฤm sรณc kh thรฌ chฦฐa ฤc tแปt lแบฏm. Cรณ 1 cรกi vรกy mua trฦฐแปc bแป thแปงng 1 lแป mร nt shop ko bแบฃo gรฌ,5
"Giao hรng nhanh, chแบฅt lฦฐแปฃng รกo phรน hแปฃp vแปi giรก tiแปn, hรฌnh แบฃnh klq ฤแป nhแบญn xu kk",5
ฤแป ฤแบนp giao hรng nhanh. Hรi lรฒng vแปi sแบฃn phแบฉm nhแบญn ฤฦฐแปฃc. H.a klq,5
"Lแบงn thแปฉ N mua hรng tแบกi shop, ฤแป shop chแบฅt cแปฑc hแปn hรฒ. Sแบฝ tiแบฟp tแปฅc แปงng hแป shop ๐.",5
Hรng cลฉng ok ... Lแบงn sau แปงng hแป shop,5
Hรฌnh แบฃnh vร video chแป mang tรญnh chแบฅt lแบฅy xu cแบฃm ฦกn shoppppppppp!,5
"Giao hรng nhanh, ฤรณng gรณi ฤแบนp, hรng nhฦฐ mรด tแบฃ, mแบทc khรก vแปซa luรดn ๐ giรก live rแบป nแปฏa",5
ฤแบงm ฤแบนp lแบฏm nha shop nhฦฐng e ko chแปฅp ฤฦฐแปฃc แบฃnh nรชn lแบฅy tแบกm แบฃnh vร video nรy vแบญy,5
ฤแบนp mร re,5
"Shop phแปฅc vแปฅ tแปt, hรฌnh แบฃnh chแป mang tรญnh chแบฅt nhแบญn xu thoai...",5
Shop gรณi hรng cแบฉn thแบญn. Giรก tแปt. Sแบฃn phแบฉm nhฦฐ hรฌnh. Giao hรng nhanh. Cรกm ฦกn shop.,5
"hรng rแบป lแบกi chแบฅt lฦฐแปฃng,ฤรฃ mua nhiแปu lแบงn rแปi",5
"sแบฃn phแบฉm ฤแบนp,chแบฅt lฦฐแปฃng tแปt,giรก cแบฃ phแบฃi chฤng..chแปง shop thแบญt dแป thฦฐฦกng.",5
"Giao hรng nhanh, ฤรณng gรณi cแบฉn thแบญn. Hรng ฤแบนp giรก ok",5
"Lแบงn ฤแบงu tiรชn mua cแปงa shop mร ฦฐng ghรช, chแบฅt xแปn, mแปn, giรก thรฌ rแบป. Like",5
