comment,rating
Hàng đẹp giá rê 😊😊😊😊😊😊😊😊😆😌😡😌☹️😤☹️😤☹️😤😊😊😊😊😊😡😞😦☺️😯😊😊😊😊😊😊😆,5
Vải chất lượng quần đẹp ủng hộ shop lần sau.đợi đơn hàng tiếp theo nữa.hihi,5
"Chất lượng ok so với giá,mua lần đầu thấy ưng cái bụng, sẽ tiếp tục ủng hộ shop",5
"Chất lượng sản phẩm khá ổn, đóng gói cẩn thận, giao hàng nhanh",5
Mua hàng shop mấy lần rồi đều ưng hết nhen. Giao hàng nhanh chóng đosng gói cẩn thận,5
Chị chủ dễ thương nhiệt tình. Áo nam thỳ chất lượng thật sự. Hơi buồn áo khoác hơi bụi nhưng c chủ bảo sẽ bù đơn sau cho mình. Nói chung là chất lượng tốt 👌,5
