comment,rating
"Vải chưa đẹp lắm nhưng với giá thế này thì tạm ổn, shop gói hàng cẩn thận!",5
"Chất vải rất là thích
Mua được giảm giá nên rất vừa lòng
Mua về mẫu y hình
Lần sau sẽ mua thêm nếu có mẫu mới",5
"Video vớ vẩn nhận xu, sp đẹp mua nhiều lần rồi cứ bôk ít về mang đảm bảo xinh , giao nhanh đóng gói cẩn thận 100d 5sao",5
"Áo đẹp, giá cả hợp lý. Giao hàng nhanh. Sẽ unhr hộ tiếp khi cần mua",5
Vải đẹp sẽ ủng hộ lần sau nữa okkkkkkkkkkkkkkkkkkkkkkkkkkkkk,5
"Chẩt vải rất thích, mềm, dày. Rất thích chất vải. 
Kiểu áo thì ok, công sở. Nói chung rất nên mua áo này",5
Vải mềm và đẹp cái này là vải ngọc trai trước mình cũng mua một cái ở nước ngoài bây giờ mua ở shop có chất vải này nên rất chi là ưng cái bụng .,5
"Hàng đợt này nhận nhanh quá, Chất lượng tuyệt vời, giá hop lý",5
