comment,rating
Sản phẩm dày dặn. Màu sắc rất đẹp.,5
Mình đã nhận đựơc túi và cảm thấy cũng tạm được. Jskekndnxhciqokwndbchudowlwmsnxhdiwsnxnxbhdiwsmnxbxydurorkrnncbcj,4
"Shop giao hàng nhanh. Túi đẹp, dày dặn nhưng hơi bé ạ. K đựng được nhiều quần áo. Vẫn cho shop 5 sao về chất lượng nhé.",5
"Chat luong san pham rat ok, khong gap van de gi trong qua trinh giao hang
De anh meo nha em vi em luoi chup anh hic",5
"Giao hàng đúng thời gian, túi đẹp, chuẩn hàng ikea. Giá phù hợp. Tốt !",5
Sản phẩm giống với giới thiệu. Không quá to. Phù hợp để đồ hè hơn.,5
Hehe ảnh và video chỉ mang tính chất lấy xu thôi ce ơi . Nhưng mà túi xinh chắc chắn vải dày dặn đẹp lắm nhé. Nhìn như mấy kiểu túi hàn quốc mà ngta đựng quần áo mùa đông ý hay lắm. Vải chống thấm túi to xịn mịn luôn,5
Túi dai chắc .................................................................,5
Hình ảnh lấy xu,5
"Shop giao hàng nhanh, túi có vẻ chắc chắn nhưng hơi nhỏ so với mong muốn",5
"Sp dày dặn , chắc chắn, giao hàng nhanh, đóng gói cẩn thận, ....,....",5
"Túi to hơn mình tưởng, dày dặn, giá tốt. Ndjjdjdjdjdmkdmdmxmkckcjcjcjckf",5
"Sp nhìn qua thì ưng, nhưng mở ra túi bé, , nói chung dùng tạm dc",1
"Túi giao nhanh đúng hàng, đúng hình. Túi chắc chắn, chất dày dặn rất ok, còn đẹp mắt nữa. Sẽ ủng hộ shop cho lần sau",5
"Túi kẻ chắc chắn, nên mua để đựng đồ mùa đông mn ạ
Túi đựng chăn thì to, nhưng có vẻ hơi mỏng chút",5
"Shop phục vụ tốt, túi đẹp, giao hàng nhanh, 5 sao!",5
"Giao hàng nhanh,không biết xách nặng có đc k?nhưng thấy dầy dặn chắc chắn",5
Vẫn cứ là đẹp.Làm hẳn 4 cái đựng cho thoải mái,5
"Túi đẹp như hình, xịn xò giá hợp lý, shop giao hàng nhanh, đóng gói cẩn thận",5
Mua lần 2. Không có j phải phàn nàn. Hi vọng k bị mủn,5
Nam Mô A Mi Đà Phật,5
"Túi dày dặn, chất liệu đẹp, đúng hàng ikea",5
Đáng mua,5
Túi rất đẹp,5
Túi chắc chắn. Tks shop,5
"Túi đẹp, nhìn chắc chắn, hơi dính bụi nên phải lau sơ",5
"Túi đẹp quá, đựng đồ vừa phải ko to quá dễ sử dụng",5
"Sản phẩm dày dặn, chỉ hơi lăn tăn là gửi 5 chiếc đúng 1 màu, kể ra nhiều màu, để đánh dấu cất đồ cho dễ thì hay hơn nữa. Nếu cần sẽ mua thêm ủng hộ shop.",4
"Đã nhận đc túi, chất đẹp miễn chê, đựng đc rất nhiều quần áo, màu sắc nhã nhặn.",5
"Giao hàng nhanh, bao chắc chắn, khá là ổn, có vẻ như k dễ bị mục như các loại khác",5
"Túi khá chắc chắn, nhưng hơi nhỏ so với nhu cầu của mình, nhưng thôi cũng ưng :D",5
"Túi đựng quần áo đẹp, cứng cáp, đứng form. Còn túi đựng chăn thì to chà bá, cũng rata cứng câp. Cả hai đều đẹp",5
Đồ tốt nha,5
"Túi đẹp, xịn xò so với giá",5
Chất lượng túi tốt hơn mong đợi. Cứng cáp và đường may chỉn chu. Khoá kéo trơn. Nói chung giá cả ok mà chất lượng có vẻ tốt hơn loạt túi đựng quần áo chăn màn hàng quảng châu,5
