comment,rating
"Mua nhiều lắm mà lười chả buồn chụp ảnh , hàng đẹp , 1,2 cái bị hơi rộng nhưng không sao",5
"Giao hàng nhanh 
Đóng gói cẩn thận 
Giá hợp lý 
Đủ sản phẩm 
Đã mua nhiều lần của shop",5
"Tàm tạm
Ảnh mang tính chất lấy xu
Ndndksksnxkesmndskksnsjsjsjssnjsjddbbdkdjdjdjdks",5
"Shop giao hàng nhanh, đóng gói cẩn thận, sản phẩm giống hình shop live, chất vải tạm dk số với giá tiền",5
Hàng sale giá rẻ mà đẹp,5
"Hàng đẹp, shop đóng góp gói cẩn thận",5
Áo jum sét kéo may dây kéo k khéo kéo lên bị sượng,3
