comment,rating
"Đóng gói cẩn thận, giao nhanh và đầy đủ hàng luôn. Lấy tạm hình nhận xu hihi",5
"Hàng y hình nha, mà thích shop lắm, rep tn nhanh và lịch sự, hàng bị lỗi có gửi lại hàng mới cho mình, nói chung là ưng lắm ạ, sẽ tiếp tục ủng hộ shop tiếp",5
"Giao hàng nhanh chóng, !!!!!!!!! 
sản phẩm tốt tiện lợi!!!!!!!!!!!!!!!!!!!!!!!! 
Màu rất ưng",5
Đã nhận được hàng. Giao hàng nhanh. Dây kéo mượt. May áo gối rất ok.,5
"Khóa chắc chắn, như hình.
Shop có tâm.
Giao hàng nhanh chóng.",5
Gói cẩn thận mong may được áo chống nắng thân dài,5
Shop giao siu nhanh,5
"Shop giao hàng nhanh, đủ hàng, nhưng phấn may đồ bị vỡ vụn mất tiu :( Cổ vũ vẫn đánh giá 5sao cho shop nhé",5
