comment,rating
"Ảnh 1 là vừa bóc hàng, nhìn cái quần mà muốn sảng luôn á 
Ảnh 2 là sau 1 hôm để n phẳng ra, mặc ra đg k vàng như nhìn ở nhà mà thành màu kem kem khá ok. Áo t không phải mua ở shop nhé",5
"Quần xinh lắm giá rẻ nữa phục vụ nhiệt tình chu đáo 
Rấc ưngggggg",5
"Akakakaakakajajajajajajajajajajajajajajajajajajagajaksnssbj
Kajajajajakajakajajajajajajajajajajajajajajjajajajajjajajakakakkakanababajabajbahabajsnnajanbajannakabvsjsksmvajakmsvsjmsmsbsbksms nssmmsnsvsvjsksnssvbsmsmsmsns",5
Giao hàng nhanh. Chất lượng sản phẩm tốt. Cảm ơn shop rất nhiều,5
"Quần ok nhưng so với mình hơi bự 
Mình sẽ mua lại 
Mn nên mua nhé",5
"Nhiều chỉ thừa,ống quần rất rộng k thể mặc được
Nhắn tin shop k phản hồi quá thất vọng về lần mua này",2
