comment,rating
"Vải mỏng pha poly nhiều, đường may ẩu, rối chỉ với rách đường chân kim. Giá phải chăng nhưng chất lương hơi kém",3
"Vải 2 áo đều đẹp, mịn mặc lên tôn dáng lắm. Mình thích áo kem cổ vest hơn. Nhưng áo có vết gì đó mình giặt ko sạch dc, phía trc và sau lưng đều có. mong những lần sau shop ktra hàng cẩn thận hơn trc khi gửi",5
"Áo chất dày, mềm , mịn. Mặc rất thích. Mua 2 áo nhưng chỉ mặc dc áo này.",5
"Áo đẹp cực kỳ. Mọi người nên mua. Vải dày dặn, mặc mát. Rất ưng ạ",5
"Chất đẹp mềm mại rất thích mặc rất sướng cảm ơn shop
Sẽ ủng hộ các sản phẩm khác
Chất lượng mà giá tốt",5
