comment,rating
"Quแบงn xinh, vแบฃi ฤแบนp, gรณi hรng ฤแบนp, cรฒn cรณ cแบฃ quร, thฦฐ cรกm ฦกn, shop chu ฤรกo chแปn chu. Chแป cรณ nhแบญn xรฉt nhฦฐ vแบญy thรดiiiiii. Mรฌnh ko ฤแป รฝ nรชn ฤแป tรชn chแปng ฤแบทt hรng. Hรng vแป thแบฅy cแบฃm ฦกn bแบกn Cรดng thรชm mแปt chรบ trรกi tim nho nhแป แปng hแบฟt hแปn tฦฐแปng cรด nรo chแปc phรก gia ฤรฌnh ๐",5
"Hngf ฤแบนp tแปt nhฦฐ hรฌnh . ฤรกng ฤแป mua .mรฌnh sแบฝ mua thรชm cรกi nแปฏa .ฤแบนp v hhhhhhhhhhhhgggffffggghhjjjแปณhhhhhjjjjjg
Hhhjjjjjjkhhhhhhhhhhhhhhhjjjjjkjjggghhhhhhhhhhhhhjjjjjjjjhhhhhhjjjjjjjjjkkkkkkkkkkkkkkkjhhjjjjjjjjkkkbvvvvbbbnnnnmnnnbhjjjjjnjnnnjnnnnnnnnnnbbbbbnnnnnnmmmmmmmmmmmmmmmmmmmmnnmmmmmmmmmmmmmmmnnn",5
"Quแบงn phแบฃi nรณi lร cแปฑc kรฌ cแปฑc kรฌ ฤแบนp vร xแปn sรฒ luรดn. Tแปซ bao bรฌ gรณi hรng, quร tแบทng kรจm ฤแบฟn cรกch giแบฃi quyแบฟt cรกc vแบฅn ฤแป cแปงa sแบฃn phแบฉm, Choobe ฤแปu lรm rแบฅt tแปt. Mรฌnh vรด cรนng hรi lรฒng vร rแบฅt highly recommended mแปi ngฦฐแปi แปงng hแป cรกc sแบฃn phแบฉm cแปงa shop nhรฉ โค๐ฅฐ๐",5
"shop phuc vu rat tot, phan hoi nhanh chong, nhiet tinh. tgian giao hang nhanh. Quan dep, vแบฃi OK. Co ca qua tag day buoc toc xinh xan nua nhe!
--> Nen mua nha mn.",5
"ฤรณng gรณi cแบฉn thแบญn . Lแบกi ฤฦฐแปฃc nhแบญn quร siรชu cฦฐng nแปฏa nรจ . Hรi lรฒng vแปi shop tแปซ khรขu tฦฐ vแบฅn ,Ship hรng ,cแบฃ nhแปฏng lแปi nhแบฏn dรnh cho ship vร khรกch hรng . Hรngg ฤแบนp lแบฏm . Nรชn sแบฝ quay lแบกi แปงng hแป shop nhen โค๏ธ๐",5
"Lแบงn thแปฉ 2 mua hรng cแปงa shop. Lแบงn nรy mua tแบญn 2 cรกi vรฌ chแบฅt qรก ฤแบนp mรกt, giao hรng nhanh nแปฏa. Mua dc giรก sale nแปฏa.",5
"Giao hรng nhanh, mแปi ฤแบทt hรดm qua mร hnay ฤรฃ nhแบญn ฤc hรng. ฤรณng gรณi cแบฉn thแบญn, quแบงn chแบฅt ok, cรฒn ฤc tแบทng kรจm quร nhแป xinh nแปฏa. Sแบฝ แปงng hแป tiแบฟp",5
Quแบงn hฦกi to,5
"quแบงn ฤแบนp, chแบฅt vแบฃi ok. mua hรng ฤฦฐแปฃc giแบฃm giรก vร ฤฦฐแปฃc tแบทng cแปt tรณc.",5
"Gรณi hรng chแปn chu, mรu tรญm dแป cฦฐng. Shop tแบทng thรชm dรขy buแปc tรณc xinh xแบฏn. Quแบงn vแบฃi dรy dแบทn, mรกt.",5
"Mแบทc cแปฑc ฦฐng รฝ. Khรดng thแบฅy bแปฅng luรดn.
Cรณ ฤiแปu cรกi quแบงn mรu be cรณ 1 ฤiแปm ฤen khรดng biแบฟt lร gรฌ giแบทt 2 lแบงn rแปi khรดng ra",5
Quรก ฤแบนp. Quแบงn ฤรบng xแปn. Ngoรi tiแปm phแบฃi 250k cho cรกi quแบงn nรy. Mรฌnh eo 62. Mแบทc size s thรฌ vแปซa. แปng loe nhรฌn chแบฅt lแปซ.,5
"Quแบงn chแบฅt ฤแบนp, form ok ฤรณng gรณi ฤแบนp cรฒn ฤc tแบทng quร nแปฏa๐๐ thanks shop",5
"Quแบงn ฤแบนp thแบญt sแปฑ, chแบฅt liแปu quรก แปn so vแปi giรก lun biแบฟt vแบญy mua thรชm vรi cรกi nแปฏa cho ฤแปก tiแปn ship
Shop ฤรณng hรng cแบฉn thแบญn, cรฒn quร tแบทng kรจm nแปฏa. Tฦฐ vแบฅn nhiแปt tรฌnh, dรน ฤรฃ muแปn nhฦฐng vแบซn trแบฃ lแปi cแปฑc nhanh. Dแบทn dรฒ ฤแปง thแปฉ, bรกn hรng thแปฑc sแปฑ cรณ tรขm",5
"Quแบงn khรดng phแบฃi chแบฅt ฤลฉi, cลฉng khรดng phแบฃi quแบงn lแปญng mร lร chแบฅt vแบฃi quแบงn รขu dรy , dรi,  แปng rแปng, nhiแปu chแป thแปซa.Mรฌnh 1m65 mร mแบทc khรดng thแบฅy dแบฅu hiแปu cแปงa lแปญng luรดn! Khรดng giแปng mรด tแบฃ! Vแปซa mua 280k xong thรฌ shop giแบฃm giรก!",4
"Quแบงn lรชn form ฤแบนp, chแบฅt mรกt, shop tฦฐ vแบฅn nhiแปt tรฌnh, giao hรng nhanh! Mรฌnh sแบฝ tiแบฟp tแปฅc แปงng hแป!",5
"Chแบฅt vแบฃi ฤแบนp, mรกt, mรu trแบฏng sแบฝ hฦกi lแป nแบฟu mแบทc nแปi y tแปi mรu. Giao hรng nhanh",5
"Quร tแบทng ฤi kรจm nhรฌn khรก cute ๐๐๐
Mรฌnh ฤang lo quแบงn trแบฏng hฦกi mแปng, sแปฃ mแบทc bแป lแป ฤแป inner ๐คฃ๐คฃ๐คฃฤแป ship rแบฅt nhanh แบก",5
"Chแบฅt vรฃi ฤแบนp, quร dt,, ฤรณng gรณi cแบฉn thแบญn, shop nhiรชt tรฌnh  .......๐ฅฐ๐ฅฐ",5
ฤแป xinh mร shop cลฉng nhiแปt tรฌnh. Lแบงn ฤแบงu cแบงm gรณi hรng mรu tรญm xinh xแบปo nhฦฐ nรy,5
Nhแบญn ฤฦฐแปฃc hรng rแปi nรจ. Shop gรณi hรng kฤฉ. Cรณ kรจm quร tแบทng nแปฏa. Vแบฃi quแบงn lแบกi ฤแบนp. Shop dแป thฦฐฦกng quรก ฤi. Yรชu,5
"Siรชu mแปn mฦฐแปฃt mแปm mแบกi mรกt mแบป tแปซ chแบฅt vแบฃi :)), form dรกng chuแบฉn nhฦฐng nแบฟu chแปn sz S mแบทc รดm form chแบฏc sแบฝ ฤแบนp hฦกn, chu ฤรกo trong khรขu ฤรณng gรณi sแบฃn phแบฉm cรฒn chuแบฉn ฤiแปm 10 dvkh vแปi quร tแบทng kแบนp tรณc xinh iu kรจm theo cฦฐng hแบฟt nแบฅc luรดn ๐",5
"Hรng vแบฃi ok, nรชn mua nha cรกc bแบกn",5
"ฤรบng nhฦฐ แบฃnh, chแบฅt lฦฐแปฃng tแปt, giao hรng nhanh, sแบฝ mua lแบกi nhiแปu lแบงn sau",5
"Mรฌnh ฤรฃ shock khi thแปญ quแบงn. Quแบงn vแปซa in, chแบฅt lแบกi ฤแบนp, ฤฦฐแปng may ฦฐng lแบฏm, lแบกi khรดng hแป cรณ chแป thแปซa hay may hแปng cรกc thแปฉ. Giรก lแบกi vรด cรนng phแบฃi chฤng. Mรฌnh ฤรฃ cรขn nhแบฏc rแบฅt nhiแปu shop rแปi chแปn mua แป shop. Vร may quรก ฤรณ lร lแปฑa chแปn ฤรบng ฤแบฏn. Mรฌnh mong shop sแปm nhแบฅt mแบซu ฤลฉi nรo dรกng dรi gแบงn giแปng ntn โญ๏ธ",5
"Quแบงn ฤแบนp lแบฏm, แปng hฦกi rแปng, vแบฃi mแปng mรกt khรดng lแป, bแบกn mรฌnh cรฒn xin chแป mua, quแบงn dรi 80cm, mรฌnh 1m50 45kg mแบทc cแบกp trรชn rแปn thรฌ trรชn mแบฏt cรก tแบงm 5cm, lแบงn sau sแบฝ quแบฅt mรu be vแปi trแบฏng๐. Dแปch vแปฅ cแปงa shop siรชu siรชu tแปt.",5
"Lแบงn ฤแบงu tiรชn ฤฦฐแปฃc mua แป shop dแป thฦฐฦกng nhฦฐ vแบงy luรดn รณ. Tแปซ bao bรฌ bรชn ngoรi ฤรฃ thแบฅy ฤฦฐแปฃc sแปฑ dแป thฦฐฦกng rแปi. Bรชn trong xinh xแปu luรดn. Vแบฃi mรกt, bao ฤแบนp. Vote tแป sao",5
"Chแปง shop rแบฅt cแบฉn thแบญn, chu ฤรกo. Sแบฃn phแบฉm nhฦฐ hรฌnh. Chแบฅt mรกt. ฤฦฐแปng may ฤฦฐแปng chแป cแบฉn thแบญn. Mรฌnh cแบงn gแบฅp vร shop giao hรng siรชu nhanh. Tแบทng kรจm chun buแปc tรณc xinh xinh nแปฏa",5
ฤรณng gรณi rแบฅt cแบฉn thแบญn hรng giao nhanh chรณng chแบฅt vแบฃi dลฉi mรกt๐๐๐๐,5
Giao hรng nhanh. Chแบฅt ฤลฉi mแปm mรกt. Shop cรฒn tแบทng quร tแบทng rแบฅt dแป thฦฐฦกng,5
"Quแบงn ฤแบนp nhฦฐ hรฌnh แบก, shop gรณi hรng nhanh vร cรฒn tแบทng thiแปp vร quร nแปฏa ๐",5
Mua 2 cรกi mรu be cลฉng ko quรก mแปng vแบฃi ฤแปฉng dรกng. ฤฦฐแปฃc shop tแบทng kแบนp tรณc vร mรฃ giแบฃm giรก. Shop tฦฐ vแบฅn nhiแปt tรฌnh.,5
"Chแบฅt vแบฃi ฤc, ฤฦฐแปng may chแบฏc chแบฏn, vแปi mรฌnh bแปฅng hฦกi kรญch size M 1m61 52kg. Nรณi chung lร cแบฃm ฦกn shop giao hรng nhanh vร gแปญi cแบฃ quร nแปฏa, chรบc shop buรดn may bรกn ฤแบฏt, mแบทc thรญch hรดm sau mรฌnh sแบฝ mua thรชm nแปฏa",5
Chแบฅt siรชu ฤแบนp <3 hรng siรชu chแบฅt lฦฐแปฃng nha mn,5
"Quแบงn ฤแบนp lแบฏm luรดn mแปi ngฦฐแปi แบก. Vแบฃi ฤลฉi mรกt, ฤรบng chแบฅt. Quแบงn รดm แป mรดng vร eo tรดn dรกng lแบฏm nhรฉ. Nรณi chung cแปฑc ฤรกng ฤแปng tiแปn bรกt gแบกo.
Cuแปi cรนng cลฉng tรฌm thแบฅy shop ruแปt cua mรฌnh rแปi nha",5
"Quแบงn ฤแบนp bแบฅt ngแป mแปi ngฦฐแปi ฦกi. Vแบฃi dรy dแบทn, ฤฦฐแปng may chแบฏc chแบฏn. 
Shop dแป thฦฐฦกng tแบทng kรจm dรขy buแปc tรณc vร Voucher giแบฃm nแปฏa",5
quแบงn ฤแบนp lแบฏm nha shop,5
"Shop giao hรng chuแบฉn mรu chuแบฉn size, ฤแบทc biแปt hรng cรฒn ฤฦฐแปฃc ฤรณng gรณi cแบฉn thแบญn vร tแบทng kรจm gift nhแป xinh nแปฏa. Mรฌnh thแปฑc sแปฑ thแบฅy hรi lรฒng tแปซ sp ฤแบฟn cรกch phแปฅc vแปฅ. Chรบc shop luรดn phรกt triแปn vร sแบฝ tiแบฟp tแปฅc แปงng hแป vรo lแบงn tแปi.",5
"rแบฅt hรi lรฒng vแป sแบฃn phแบฉm, cแบฃm ฦกn shop ฤรฃ gแปญi tแบทng nฦก buแปc tรณc dแป thฦฐฦกng, sแบฝ แปงng hแป shop lรขu dรi",5
"Giao hรng nhanh, chแบฅt quแบงn ok, mแปi ng nรชn mua",5
"Chแบฅt lฦฐแปฃng sแบฃn phแบฉm tuyแปt vแปi ฤรณng gรณi nhanh okie okie lalalallalllalaa. Giao ฤรบng sp, ฦฐng รฝ vแปi giรก vร chแบฅt lฦฐแปฃng",5
"Dแปch vแปฅ cแปงa shop rแบฅt tแปt nhรฉ, t phแบฃn hแปi vแป cรกi cรบc ฤฦกm khรดng cแบฉn thแบญn lแบฏm thรฌ ngay lแบญp tแปฉc shop nhแบฏn giแบฃi thรญch vร gแปญi 10k tiแปn ฤt luรดn๐, dรน t review thแบญt lรฒng chแปฉ khรดng cรณ รฝ chรช trรกch hay bแบฏt ฤแปn gรฌ cแบฃ. Vแบฃi ฤแบนp, khรดng nhฤn vร cลฉng khรดng lแป quแบงn trong nhรฉ cรกc bแบกn",5
Quแบงn chแบฅt thรญch lแบฏm แบก <3 mแปt sแป bแบกn nรณi lแป nแปi y nhฦฐng mร mรฌnh thแบฅy nแบฟu khรดng phแบฃi cรกc mรu tแปi nhฦฐ ฤen/tรญm than thรฌ khรดng cรณ lแป ฤรขu. Lรบc nรo cรณ tiแปn mรฌnh phแบฃi tแบญu thรชm mแบฅy em mแปi ฤฦฐแปฃc <3 Shop cลฉng nhiแปt tรฌnh vร cแปฑc dแป thฦฐฦกng,5
Vแบฃi mแปm rแบฅt thรญch,5
"Chแบฅt ฤแบนp, gรณi xinh cรฒn cรณ thiแบฟp xinh vร quร tแบทng nแปฏa, quรก ฤรกng iu lun,sแบฝ แปงng hแป shop dรi dรi",5
"Quแบงn siรชu ฤแบนp luรดn nha mแปi ngฦฐแปi. Lรบc ฤแบงu nhรฌn form trรชn ฤรกnh giรก tแป cลฉng phรขn vรขn lแบฏm, nhฦฐng mร mแบทc rแปi mแปi thแบฅy quรก แปn. Lรชn form cแบกp cao tรดn dรกng. Thรญch hแปฃp cho mแบฅy bแบกn cรณ vรฒng 3 mแปt xรญu nha
ฤรกnh ฤแปng tiแปn bรกt gแบกo, nรชn mua nha mแปi ngฦฐแปi",5
"Chแบฅt vแบฃi mรกt, size vแปซa vแบทn vแปi body, quแบงn k mแปng nhฦฐ mรฌnh tฦฐแปng, cแบฃm thแบฅy hรi lรฒng. Cแบฃm ฦกn shop nhiแปu nhรฉ.",5
Mua quแบงn nรy mรu ฤen cแปงa shop 1 lแบงn rแปi ฦฐng lแบฏm nรชn mua lแบกi. Lแบงn nรy mua mรu be nhฦฐng cรณ vแบป mรu be nรy hฦกi sรกng. Mรฌnh thรญch mรu tแปi hฦกn 1 chรบt. Vแบฃi ฤลฉi mแปm mรกt. Thanks shop.,5
"Chแบฅt vแบฃi mแปm,rลฉ nhแบน,รญt nhฤn hฦกn nhแปฏng loแบกi khรกc,mรฌnh nghฤฉ giรก nhฦฐ vแบญy rแบฅt ฤรกng ฤแป mua, shop cรฒn tแบทng thun cแปt tรณc nแปฏa ๐
Dรi quแบงn nhฦฐ hรฌnh luรดn ,mรฌnh mua size S mแบทc vแปซa y .",5
"Quแบงn rแบฅt ฤแบนp, mแบทc rแบฅt thรญch vร thoแบฃi mรกi. Cรณ ฤiแปu mรฌnh nhแป con quรก nรชn thแบฅy hฦกi rแปng xรญu :v",5
"Cแบฃm ฦกn shop chแบฅt ฤแบนp, ฤรกng mua nha mn
Shop giao hรng nhanh",5
"Quแบงn y hรฌnh, chแบฅt dรy dแบทn ฤแบนp, mua giรก rแบป rแบฅt hแปi, vote shop 5 sao nhรฉ giao hรng nhanh",5
"Chแบฅt quแบงn ฤแบนp, tuy nhiรชn chแบฅt vแบฃi hฦกi mแปng dแป lแป mรu nแปi y bรชn trong ๐ cแบฃm ฦกn shop๐ฅฐโค๏ธ",5
"Quแบงn vแปซa vแบทn, vแบฃi ฤแบนp, chแปง shop tฦฐ vแบฅn nhiแปt tรฌnh nรชn mรฌnh chแปn ฤรบng size. Vรฌ mรฌnh hฦกi thแบฅp nรชn nhรฌn dรi chแปฉ m6 mแบทc sแบฝ lแปญng hฦกn nha",5
"Quแบงn ฤแบนp, may cแบฉn thแบญn, giao siรชu nhanh, rแบฅt hรi lรฒng",5
"Giao hรng nhanh nhฦฐ mแปt cฦกn giรณ แบก vแปi cแบฃm ฦกn mรณn quร xinh xinh cแปงa shop . Mรฌnh ฦฐng nhแบฅt lร tรบi cแปงa quแบงn cรณ thแป ฤแปฑng ฤc ฤt chแปฉ k phแบฃi lร tรบi nรดng , giแบฃ tรบi .",5
"Mแบทc ฤแบนp, vแบฃi hฦกi mแปng nhฦฐng giao hรng nhanh, cรฒn ฤฦฐแปฃc tแบทng quร nแปฏa.",5
"mรฌnh hฦกi nhแป lรชn quแบงn bแป rแปng bแปฅng. tuy nhiรชn vแบซn cho shop 5 sao vรฌ quแบงn mรกt, ฤแบนp vร shop rแบฅt dแป thฦฐฦกng. trรดng ฤแบนp lm mร mรฌnh chแปฅp hฦกi bแป dรฌm hรng tรญ nhรฉ!",5
Quแบงn rแบฅt ฤแบนp nha mแปi ngฦฐแปi ^^ chแบฅt vแบฃi dรy dแบทn vร mรกt. Thรชm tแบฅm thiแปp ghi tรชn tแปซng khรกch hรng cแปงa shop rแบฅt dแป thฦฐฦกng. Cรณ lฦฐฦกng lแบกi แปงng hแป shop tiแบฟp แบก ๐,5
"Quแบงn form ฤแบนp, cรณ ฤai lรm eo trรดng nhแป hฦกn, phรญa sau cรณ chun nรชn mแบทc thoแบฃi mรกi. Chแบฅt vแบฃi hฦกi dแป nhฤn nhฦฐng khรดng sao. Nรณi chung so vแป giรก thรฌ chแบฅt lฦฐแปฃng แปn.
Shop tฦฐ vแบฅn nhiแปt tรฌnh, ฤรณng gรณi cแบฉn thแบญn, mรฌnh cรฒn ฤฦฐแปฃc tแบทng chun nแปฏa.",5
"Shop chu ฤรกo, ฤc tแบทng kรจm voucher  vร dรขy buแปc tรณc xinh kute
Mรu nรขu hฦกi khรกc hรฌnh 1 chรบt
Mรฌnh cao m62 thรฌ hฦกi bแป lแปญng hฦกn mแบซu mแบทc 1 chรบt
Chแบฅt vแบฃi ok nhรฉ",5
"Giao hรng siรชu nhanh, nhแบญn ฤฦฐแปฃc hรng sau 1 ngรy. Shop tแบทng thรชm quร vร voucher giแบฃm giรก, quรก ฦฐng luรดn. Quแบงn ฤแบนp, ko bแป quรก mแปng, tuy nhiรชn ฤฦฐแปng may ko ฤฦฐแปฃc chแบฏc chแบฏn lแบฏm.",5
"Quแบงn vแบฃi mแปm mแบทc nhแบน thoแบฃi mรกi, lฦฐng thun, แปng quแบงn rแปng quรก dแบกng nhฦฐ loe luรดn รฝ, boฬp แปng lแบกi sแบฝ ฤแบนp hฦกn, mรฌnh cao 1m55 nแบทng 50kg eo 74 mรดng 93 mแบทc sz M vแปซa y.",5
Quแบงn chแบฅt ฤแบนp lแบฏm. Form mแบทc lรชn cลฉng ฤแบนp. Cรฒn mแบฅy bแบกn chรช quแบงn mแปng thรฌ mรฌnh thแบฅy lร chแบฅt ฤลฉi hแบงu nhฦฐ mแปng nhแบน nรชn chแปn quแบงn chip phรน hแปฃp lร ฤฦฐแปฃc . ฤแปซng chรช lแป hรng nรy nแป ฤรกnh sao thแบฅp khแป thรขn bแบกn bรกn hรng,5
"Shop nhiแปt tรฌnh vร cskh tแปt lแบฏm luรดn. Quแบงn chแบฅt ฤแบนp, cรณ thiแปp cแบฃm ฦกn vร ฤฦฐแปฃc tแบทng 1 chiแบฟc kแบนp tรณc xinh xinh nแปฏa, sแบฝ giแปi thiแปu cho bแบกn bรจ cรนng mua nแปฏa",5
Mแบงu vรng ฤแบญm nha. ฤแบนp lแบฏm shop ฦกi. Mแบทc ฤi chฦกi hแปฃp hฦกn chแปฉ ฤi lรm thรฌ hฦกi cแปc.,5
"Giao hรng nhanh, ฤรณng gรณi cแบฉn thแบญn, quแบงn rแบฅt ฤแบนp, giรก hแปฃp lรฝ sแบฝ tiแบฟp tแปฅc แปงng hแป",5
"Hรng ฤแบนp, sฤn sale giรก rแบป, mรu trแบฏng khรก แปn, k quรก mแปng. M cแปฉ sแปฃ mแปng te nhฦฐ cรกc shop khรกc bรกn. Mแบทc vแปซa chuแบฉn ฤแบนp. Sแบฝ tiแบฟp tแปฅc mua nhแปฏng mรu khรกc^^",5
"Sแบฃn phแบฉm ฤฦฐแปng may ฤแบนp, tuy nhiรชn mรฌnh khรดng thรญch dรกng quแบงn vร chแบฅt vแบฃi, shop cรณ tแบทng kรจm quร vร thฦฐ cแบฃm ฦกn, vote 5s cho cรกch phแปฅc vแปฅ",5
Quแบงn rแบฅt ฤแบนp vร shop phแปฅc vแปฅ khรกch hรng rแบฅt tแปt. Vแป khรขu chฤm sรณc khรกch hรng cho hแบณng 5 sao. Vแป hรng thรฌ mแปng nhแบน khรดng cรณ tฦฐa chแป. Hรฌnh sao hรng thแบฟ. Khรก chu ฤรกo khi gรณi hรng cแบฉn thแบญn vร tแบทng kรจm cแปt tรณc. Chแบฏc chแบฏn sแบฝ quay lแบกi vรo 1 ngรy khรดng xa,5
"Chแบฅt thรญch lแบฏm, mแปi tแปi mรฌnh ฤรกnh giรก hฦกi thแบฅp vแป vรฒng bแปฅng cแปงa bแบฃn thรขn nรชn hฦกi kรญch bแปฅng ๐, sang tรชn cho ฤแปฉa e gรกi ฤแป quแบฅt ฤรดi sz to hฦกn.",5
Mua hรng lแบงn 2 cแปงa shop vร thแบญt sแปฑ vแบซn rแบฅt chim ฦฐng. Lแบงn nรo cลฉng dc tแบทng 1mรณn quร nhแป xinh nแปฏa. Sแบฝ แปงng hแป shop dรi dรi,5
"Quแบงn mแบทc thoแบฃi mรกi, chแบฅt ฤแบนp, shop tแบญn tรฌnh, chแบฅt lฦฐแปฃng dแปch vแปฅ tแปt.
Nhฦฐng cรบc bแป lแปng, mรฌnh phแบฃi khรขu lแบกi. Note ฤแป shop ฤแป รฝ ฤฦกn khรกc",5
"Hang chat lieu dep nha shop, se ung ho shop san pham khac nua, mong shop phat huy uy tin nay nhe.",5
Quแบงn ฤแบนp mแบทc rแบฅt vแปซa luรดn. Sแบฝ mua tiแบฟp แปงng hแป shop nรจ,5
"Shop giao hรng nhanh, vแปซa ฤแบทt tแปi htrc hsau giao hรng luรดn. Quแบงn chแบฅt vแบฃi mแปm & mรกt, khรดng biแบฟt sau khi giแบทt cรณ bแป ... k . Cรฒn jo thรฌ Ok, ฤรกng tiแปn nhรฉ.",5
"Shop ฤรณng hรng cแบฉn thแบญn, dแป thฦฐฦกng, giao hรng nhanh. Quแบงn chแบฅt vแบฃi ฤแบนp, ฤฦฐแปng may chแบฏc chแบฏn, mแบทc lรชn form chuแบฉn ok. Khi giแบทt hฦกi phai 1 tแบนo",5
"Chรนi ui mua ฤรบng shop nรy quแบงn siu xinhh luรดn mแปi ngฦฐแปi แบก, bรฌnh thฦฐแปng khi mua mรฌnh phแบฃi ฤแปc cmt xem mแปi ngฦฐแปi phแบฃn hแปi nhฦฐ thแบฟ nรo mแปi yรชn tรขm , quแบงn ฤแบนp lแบฏm nhฦฐng mรฌnh chแปฅp hฦกi xแบฅu thuiii :(( ngoรi ฤแปi chแบฅt lฦฐแปฃng lแบฏm lun ๐โค๏ธ๐ฅฐ๐ฅฐ๐ฅฐ๐ฅฐ sแบฝ แปงng hแป mรฃi ๐ฅฐ๐",5
"Quแบงn siรชu ฤแบนp nhรฉ แบก. Mรฌnh sแปฃ chแบญt mรดng nhฦฐng shop tฦฐ vแบฅn ok quรก แบก, mแบทc rแบฅt thoแบฃi mรกi. Vแบฃi ฤลฉi mแปn mรกt, giแบทt k bแป co vแบฃi nhฦฐ mแบฅy loแบกi khรกc",5
Hรng ฤแบนp. Cแบฃm ฦกn shop vรฌ mรณn quร.๐๐. Lแบงn ฤแบงu mua mร mua tแบญn 3 cรกi luรดn. Nรณi chung rแบฅt ฦฐng nhฦฐng hฦกi chแบญt.,5
"Quแบงn ฤแบนp, vแบซn chแบฅt lฦฐแปฃng ngon nghแบป dแปch vแปฅ tแปt nhฦฐ mแปi lแบงn hehehehehehe",5
Lแบงn thแปฉ 2 mua ฤแป แป shop thแบญt sแปฑ rแบฅt thรญch. Sแบฝ แปงng hแป shop dรi dรi hihi,5
"Quแบงn siรชu ฤแบนppp luรดn, chแบฅt vแบฃi tแปt dรy chแปฉ k bแป mแปng. Shop ฤรณng gรณi ฤแบนp vร cรณ quร tแบทng nแปฏa",5
"Shop tฦฐ vแบฅn rแบฅt nhiแปt tรฌnh vร dแป thฦฐฦกng, nhแป shop mรฌnh ฤรฃ chแปn ฤฦฐแปฃc size quแบงn khรก lร ฦฐng รฝ. Vแป quแบงn thรฌ chแบฅt vแบฃi siu siu xแปn luรดn nha, tuy lร hฦกi ngแบฏn vแปi mรฌnh mแปt chรบt xรญu (mรฌnh cao 1m67). Mรu trแบฏng thรฌ hฦกi mแปng mแปt xรญu xiu thui, nรชn khi mแบทc chแปn quแบงn lรณt mรu nude thรฌ khรดng sao ฤรขu nhaaaa โค๏ธ",5
"Mua lแบงn hai cแปงa shop rแปi, tแปng 6 chiแบฟc lแบญn, mแบทc nhแบน mรกt thรญch lแบฏm, mแปi tแปi khรดng lแบงn nรo dรนng ฤc voucher giแบฃm giรก shop tแบทng",5
Qua ฦฐng แบก. Shop tฦฐ vแบฅn nhiแปt tรฌnh. Mร gรณi ฤแป siรชu xinh. ฦฏng ngay แบก,5
