comment,rating
"Nhแบญn hรng thแปฑc sแปฑ vรด cรนng hรi lรฒng, shop ฤรณng gรณi cแบฉn thแบญn, hรng giao ฤรบng mแบซu vร size
รo mแบทc mรกt, quแบงn form dรกng ฤแบนp, cรฒn cรณ quร tแบทng ฤi kรจm nแปฏa
Mแบฅy chแป cรนng phรฒng ai cลฉng khen
Sแบฝ cรฒn แปงng hแป vร giแปi thiแปu cho shop nแปฏa
Chรบc shop lรm ฤn ngรy cรng phรกt ฤแบกt nha",5
"Chแบฅt vแบฃi mรกt, nhแบน. ฤรณng gรณi siรชu dแป thฦฐฦกng cรฒn ฤc tแบทng kรจm buแปc tรณc. Lแบงn ฤแบงu mua quแบงn dรกng nรy mแบทc. Giรก flash sale 129k siรชu rแบป.",5
"Quแบงn ฤรบng size, ฤรบng mรu, chแบฅt ฤลฉi mแปm mรกt ฦฐng hแบฟt sแปฉc luรดn, sแบฝ mua tiแบฟp แบก",5
"Mแบฅy lแบงn mua hรng cแปงa shop vร ฤรขy lร lแบงn thแปฉ 2 mua cรกi quแบงn nรy. Vแบฃi mรกt, mแบทc vรด cรนng thoแบฃi mรกi, giรก cแบฃ phรฌ hแปฃp. Shop rแบฅt chu ฤรกo, cแบฉn thแบญn, gรณi hรng rแบฅt iu vร hay tแบทng mรฃ sale",5
"Hรng chแบฅt ok, xแปญ lรฝ ฤฦกn hรng nhanh, shop cรณ tแบทng mรณn quร nho nhแป xinh, nรณi chung tแปt",5
Hรng vแป nhanh klllmjnnnnnnnnnjjjjjjjjhhhbhhhhhhhhhhhhhu,5
"Hรng ฤแบนp, shop gรณi hรng nhฦฐ gรณi quร. ฦฏng lแบฏm. Thanks shop nhiแปu nhiแปu nhรก.....
Chรบc shop phรกt tรi. Sแบฝ แปงng hแป shop dรi...",5
"Vแบฃi quแบงn nรขu dรy vแปซa ฤแปง khรดng sแปฃ lแป hรng, mแบทc mรนa hรจ khรดng nรณng. Shop tแบทng kรจm chun buแปc tรณc.",5
quแบงn chแบฅt mแบทc nhแบน mรกt mk mแบทc sz S vแปซa in luรดn mแบทc co dรฃn thoแบฃi mรกi cแปฑc thรญch nhรฉ m.n nรชn mua nha hรจ mแบทc mแบฅy quแบงn nรy lร mรกt nรจ ๐๐๐๐๐ฅฐ๐ฅฐ,5
Quแบงn ฤแบนp lแบฏm nhรฉ. ฦฏng lแบฏm luรดn. ฤฦฐแปฃc giรก sale 145k quรก ok. Khรฉo mua maya mรu thay ฤแปi,5
"Quแบงn vแปซa vแบทn, mแบทc mรกt, nhฦฐng mรu trแบฏng toรกt trรดng giแปng quแบงn bแปnh viแปn / tแบญp vรต lแบฏm :)))",4
ฤรฃ mua 2 lแบงn quแบงn mแบทc thoแบฃi mรกi shop lแบงn nรo cลฉng kรจm buแปc tรณc๐๐ป๐๐ป,5
Quแบงn vแบฃi rแบฅt ฤแบนp. Ban ฤแบงu quแบงn m bแป cรณ 1 vแบฟt bแบฉn nhแป nhฦฐng shop ฤรฃ ฤแปi lแบกi quแบงn mแปi cho m. Cแปฑc kแปณ uy tรญn vร chแบฅt lฦฐแปฃng nhรฉ ๐ sแบฝ แปงng hแป shop lรขu dรi ๐๐๐,5
ฤรฃ nhแบญn hรng. Chแบฅt quแบงn ฤแบนp. Sแบฝ แปงng hแป tiรชdpkbvdtihcdyuhgfgi,5
"Quแบงn ฤแบนp lรฉm. 
Hรฌnh แบฃnh video chแป mang tรญnh chแบฅt nhแบญn xu thui ^^",5
"Quแบงn ฤแบนp,  vแบฃi ฤแบนp vแปซa in luรดn แบก, nแบฟu cรณ thแป sแบฝ mua lแบงn nแปฏa, do mang ฤi giแบทt mแบฅt rแปi nรชn ฤรnh lแบฅy hรฌnh khรดng liรชn quan :))",5
"Quแบงn chแบฅt ฤแบนp, mรกt, ฤรฃ mua lแบงn 2!lแบงn nรo shop cลฉng cรณ quร tแบทng dแป thฦฐฦกng .",5
"Sp cลฉng dc,,,,,,,,(((((())))โซโซ))((())((!โซ!!โซ&&'hhhhhb hรฌnh แบฃnh mang tรญnh chแบฅt nhแบญn xu vรฌ quแบงn mang ฤi sแปญa,ai cao mแบทc hแปฃp",5
"Sแบฃn phแบฉm giแปng vแปi mรด tแบฃ, ko nghฤฉ แปng quแบงn to quรก, chแบฅt mแปm mรขt, dc tแบทng kรจm dรขy buแปc tรณc, thanks shop",5
"รo ฤแบนp, chแบฅt mรกt hฦกn cแบฃ kรฌ vแปng.
Quแบงn ฤลฉi dรy dแบทn
Sแบฝ แปงng hแป shop lแบงn nแปฏa",5
"Giao hรng nhanh, ฤรณng gรณi cแบฉn thแบญn, chแบฅt ฤแบนp mua lแบงn thแปฉ 2 rแปi thแบฅy rแบฅt ฦฐng sแบฝ แปงng hแป dรi dรi",5
Mรฌnh ฤฦฐแปฃc tแบทng thรชm dรขy buแปc tรณc vร cแบทp nแปฏa nรจ,5
"Quแบงn ฤแบนp, gรณi hรng kฤฉ, ฦฐng แบกaaaaaaaaaaaaaaaaaaaaaaaaaaaa",5
"Chแบฅt vแบฃi mแบทc nhแบน, mรกt, ฤฦฐแปฃc tแบทng thรชm 1 cรกi kแบนp tรณc,.............",5
"Quแบงn ฤแบนp, giรก rแบป, hรi lรฒng nha. Quแบงn ฤแบนp, giรก rแบป, hรi lรฒng nha.",5
"Xuแบฅt sแบฏc. รo ฤแบนp, chแบฅt mรกt. Shop ฤรณng gรณi dแป thฦฐฦกng nhฦฐ quร tแบทng แบฅy. Sแบฝ แปงng hแป shop.",5
Hรฌnh khรดng liรชn quan nhฦฐng mรฌnh rแบฅt thรญch quแบงn nhรฉ! Lแบงn sau sแบฝ mua tiแบฟp,5
"Shop phแปฅc vแปฅ tแปt, mua ฤแปฃt sale ฤฦฐแปฃc giรก rแบป cแบฃ quแบงn lแบซn รกo, chแบฅt lฦฐแปฃng phรน hแปฃp giรก tiแปn",5
Sแบฃn phแบฉm ฤแบนp xxjdklฤhkehekshdgjdkssk,5
"Giao hรng nhanh, chแบฅt lฦฐแปฃng sแบฃn phแบฉm tuyแปt vแปi, cรฒn ฤฦฐแปฃc tแบทng dรขy buแปc tรณc nแปฏa แบก",5
"Mua 6 sแบฃn phแบฉm ฤแปu xแปn, giรก quรก oke so vแปi chแบฅt lฦฐแปฃng, giao hรng nhanh chแป 1 ngรy lร nhแบญn ฤc, shop cรฒn tแบทng thรชm cแบทp tรณc siรชu xinh. Gรณi hรng cแบฉn thแบญn, ฤแบนp",5
Sr vแป h/a mang tรญnh chแบฅt nhแบญn xu. Vรฌ รกo m ฤang giแบทt ๐. รo ฤแบนp y hรฌnh. Chแบฅt mรกt. Quay mรกy giแบทt thแบฅy k hแป hแบฅn gรฌ,5
"Lแบงn thแปฉ 2 mua hรng rแปi, 2 lแบงn ฤแปu cรณ quร vร thฦฐ cแบฃm ฦกn rแบฅc iu. Quแบงn xinh, vแบฃi mรกt, mแบทc mรนa nรณng rแบฅt thoแบฃi mรกi, ฤรกng mua nha mn",5
Quแบงn chแบฅt liแปu vแบฃi dรy mร shop ko kiแปm tra lแบกi quแบงn hay sao รก bแป thiแบฟu nรบt quแบงn. Shop cรณ tแบทng cแปt tรณc vร kแบนp tรณc dแป thฦฐฦกng. Nhฦฐng vแบซn ฤรกnh giรก 5 sao,5
"Quแบงn dรy dแบทn, xinh lแบฏm nhรฉ. Lแบกi cรฒn ฤฦฐแปฃc tแบทng vc 10k cho ฤฦกn hรng kแบฟ tiแบฟp vร dรขy buแปc tรณc xinh xแบฏn nแปฏa. Tk shop.",5
"Quแบงn xinh xแปu mร giรก sale cรฒn rแบป. Shop chu ฤรกo, cแบฉn thแบญn, ฤรกng iu vรด cรนng vรฌ cรฒn cรณ note dรกn bรชn ngoรi cแบฃm ฦกn shipper luรดnn",5
Mรฌnh mua cแบฃ รกo quรขy cแบฃ quแบงn cแปงa shop luรดn. Khรดng phแบฃi 1 bแป nhฦฐng rแบฅt hแปฃp lรฝ ฤแป mix thรnh 1 bแป. Chแบฅt vแบฃi cแบฃ  2 ฤแปu ฤแบนp. Chแบฅt ฤลฉi cแปงa quแบงn ฤแบนp hฦกn rแบฅt nhiแปu loแบกi vแบฃi ฤลฉi ฤแป may quแบงn dรกng nรy bรกn tแบงm 100k trรชn thแป trฦฐแปng. Thแบฅy nhiแปu ngฦฐแปi chรช vแบฃi mแปng thรฌ mรฌnh nghฤฉ lร vแบฃi ฤลฉi mร dรy hฦกn nแปฏa sแบฝ bแป nรณng,5
"Quแบงn รกo rแบป ฤแบนp vแปซa vแบทn, shop phแปฅc vแปฅ tแปt ฤc tแบทng  mรฃ giแบฃm giรก, hรi lรฒng vแปi sแบฃn phแบฉm vร giรก tiแปn, tiแบฟp tแปฅc แปงng hแป",5
"Chแบฅt vแบฃi cลฉng dc. Mร thแบฅy rแปng quรก, mรฌnh lแบฅy size s mร vแบซn rแปng แบฅy. Huy hiแปu dแป thฦฐฦกng",5
"Chแบฅt แปn giรก tแปt. Quแบงn lรชn dรกng ฤแบนp. Mua hรng ฤc tแบทng chun buแปc tรณc vร cแบทp tรณc. Ship hรng rแบฅt nhanh.
แบขnh mang tรญnh chแบฅt nhแบญn xu",5
"Quแบงn rแบฅt ฦฐng รฝ, chแบฅt vรฃi ฤลฉi oke ko thรกy nhแบฏn nhรฌu, chแบฅt lฦฐแปฃng ๐",5
"Vd khรดng liรชn quan. Quแบงn ฤแบนp, shop chuแบฉn bแป hรng nhanh, shop cรฒn tแบทng thรชm cแปt tรณc nแปฏa. Sแบฝ quay lแบกi แปงng hแป shop",5
"Quแบงn y hรฌnh, chuแบฉn mรu vแปi size. Giao hรng nhanh. chแบฅt vแบฃi cแบฃm giรกc ko mรกt lแบฏm, nhฦฐng chแบฅp nhแบญn ฤฦฐแปฃc. ฤฦฐแปฃc tแบทng 1 kแบนp tรณc",5
"Chแบฅt vแบฃi xแปn lแบฏm mng ฦกi
Gรณi hรng thรฌ cแบฉn thแบญn siรชu yรชu luรดn
Mรฌnh sแบฝ quay lแบกi shop ฤแป mua thรชm nhiแปu sแบฃn phรขm",5
Sp giแปng hรฌnh. Vแบฃi hฦกi nhฤn. Shop cรฒn tแบทng bao xรฌ lรฌ vร thiแปp..........,5
Quแบงn ฤแบนp lแบฏm แบก ! Chแบฅt vแบฃi rแบฅt oke giรก cลฉng แปn nแปฏa ! Mร mรฌnh bแป giao thiแบฟu dรขy chuyแปn nhฦฐng mร shop ฤรฃ liรชn hแป ฤแป nแบกp tiแปn ! Rแบฅt ฦฐng thรกi ฤแป phแปฅc vแปฅ bรชn shop แบก,5
Thแปฑc sแปฑ rแบฅt hรi lรฒng vแป sแบฃn phแบฉm vร cรกch phแปฅc vแปฅ cแปงa shop. Cรณ 10 sao lร cho shop 10 sao rแปi. Cรฒn ฤฦฐแปฃc tแบทng kรจm bฤng ฤรด. Mรฃi yรชu. ๐ฅฐ๐ฅฐ๐ฅฐ,5
"Quแบงn lแปญng, khรก xinh, vแบฃi ko quรก mแปng, ฤรณng gรณi xinh kรจm quร nแปฏa",5
Lay tam anh va video cu nha quan thi mua ve chua thu chua biet sao nua nhug van thich do ben shop nen danh gia 5 sao luon chat vai thay cug dep nua ne,5
"Vแบฃi ฤแบนp, thoรกng mรกt, giao hรng nhanh, ฤรณng gรณi cแบฉn thแบญn, rแบฅt ok",5
"Lแบงn ฤแบงu mua hรng cแปงa shop, sp tแบกm แปn trong tแบงm giรก. Nhฦฐng bแป phแบญn check ib vร kho cแปงa shop ko ฤแปng nhแบฅt, ฤแปi lแบงn 2 mร vแบซn sai thรดng tin cho Kh. Shop ฤรฃ xแปญ lรฝ ok ๐ช๐ป",5
"Quแบงn ฤแบนp lแบฏm luรดn รฝ แบก โค๏ธ vแบฃi ฤแบนp, dรy dแบทn mแบทc khรดng bแป mแปng nhฦฐ nhแปฏng mแบซu khรกc. Shop giao hรng nhanh, mรฌnh cรฒn ฤc tแบทng thรชm cรกi ฤแป cแปt siu ฤรกng iu nแปฏa โค๏ธ",5
"Quรขฬn ฤeฬฃp,  ฤoฬng goฬi haฬng can thรขฬฃn,  giaฬ tรดฬt,  thฦกฬi gian giao haฬng nhanh,  shop de thฦฐฦกng",5
"ฤรฃ nhแบญn ฤฦฐแปฃc hรng vรi ngรy nhฦฐng lฦฐแปi ฤรกnh giรก, vรฌ 200 xu nรชn cแป gแบฏng vแบญy. Hรng ฤฦฐแปฃc ฤรณng gรณi chแบฏc chแบฏn, giao hรng nhanh. Hรng chรญnh hรฃng, ฤแบนp, bแปn, chแบฏc chแบฏn. Hรฌnh แบฃnh lร mฦฐแปฃn tแบกm nhฦฐng bรชn ngoรi cลฉng giแปng nhฦฐ vแบญy, ฤฦฐแปฃc tแบทng cแปt tรณc vร mแปi ฤแบทt mua thรชm 2 cรกi cho ฤแปฉa bแบกn",5
"๐ quแบงn rแปng, mรกt, mแบทc thoแบฃi mรกi. Mua ngay ฤแปฃt khuyแบฟn mรฃi nรชn quรก tiแปn.",5
Quแบงn ฤแบนp. Vแปซa y cรณ thฦฐ cรกm ฦกn,5
"ฤรฃ nhแบญn ฤฦฐแปฃc hรng vรi ngรy nhฦฐng lฦฐแปi ฤรกnh giรก, vรฌ 200 xu nรชn cแป gแบฏng vแบญy. Hรng ฤฦฐแปฃc ฤรณng gรณi chแบฏc chแบฏn, giao hรng nhanh. Hรng chรญnh hรฃng, ฤแบนp, bแปn, chแบฏc chแบฏn. Hรฌnh แบฃnh lร mฦฐแปฃn tแบกm nhฦฐng bรชn ngoรi cลฉng giแปng nhฦฐ vแบญy, ฤฦฐแปฃc tแบทng cแปt tรณc vร mแปi ฤแบทt mua thรชm 2 cรกi cho ฤแปฉa bแบกn",5
"ฤรฃ nhแบญn ฤฦฐแปฃc hรng vรi ngรy nhฦฐng lฦฐแปi ฤรกnh giรก, vรฌ 200 xu nรชn cแป gแบฏng vแบญy. Hรng ฤฦฐแปฃc ฤรณng gรณi chแบฏc chแบฏn, giao hรng nhanh. Hรng chรญnh hรฃng, ฤแบนp, bแปn, chแบฏc chแบฏn. Hรฌnh แบฃnh lร mฦฐแปฃn tแบกm nhฦฐng bรชn ngoรi cลฉng giแปng nhฦฐ vแบญy, ฤฦฐแปฃc tแบทng cแปt tรณc vร mแปi ฤแบทt mua thรชm 2 cรกi cho ฤแปฉa bแบกn",5
"Lแบงn ฤแบงu tiรชn mua hรng mร shop lรm mรฌnh แบฅn tฦฐแปฃng lแบฏm lun, tแปซ khรขu tฦฐ vแบฅn tแปi khรขu gรณi hรng cแปฑc chแปnh chu. ฤแบทc biแปt, mua ฤแป แป shop sแบฝ ฤฦฐแปฃc nhแบฏn tin nhแบฏc nhแป vแป ฤฦกn hรng thฦฐแปng xuyรชn, quan tรขm รขn cแบงn hฦกn ngฦฐแปi yรชu mรฌnh luรดn รก :) vร cรฒn hay cho voucher giแบฃm giรก. Nรณi chung lร ฦฐng, vote 11/10.",5
"mรฌnh cao 1.68 - 58kg size L vแปซa , thแบญt ra M cลฉng vแปซa luรดn mร chแปn L cho thoแบฃi mรกi. mแบทc แป nhร thoแบฃi mรกi, mรu ฤen vร be ฤแบนp",5
"Quแบงn ฤแบนp, lรชn form xinh lแบฏm แบก. Sแบฝ แปงng hแป shop lแบงn sau. Thanks shop",5
Kaksjjdndjxkshsudndjxnxhsujabdydjsnshdgjsnsjsjjdjdhj,5
giแปทhiikhguookbhffuijbcddulbcflmjhoooooookkkkkkkooooookkk4677888ยฃยฅยฃยฃยฃยฃโฌโฌ7,5
"Shop chu ฤรกo, cรณ tแบทng kรจm quร xinh xinh. Quแบงn ฤแบนp vร mแบทc thoแบฃi mรกi.",5
Okkkkkkkkkkkkkkkkkkkkkkkkkkkkkkkkkkkkkkkkkkkkkkkkkkk,5
"Quแบงn oke ฤฦฐแปng may แปn so vแปi tแบงm giรก, mรฌnh mua mแบทc thแปญ oke sแบฝ mua tiแบฟp",5
Okkkkkkkkkkkkkkkkkkkkkkkkkkkkkkkkkkkkkkkkkkkkkkkkkkkkkkkkkkkkkkk,5
"Chฦฐa bao giแป mรฌnh mua quแบงn รกo online mร vแปซa รฝ ฤแบฟn vแบญy luรดn. Vแบฃi rแบฅt ok, may kฤฉ, size vแปซa y mร y nhฦฐ hรฌnh nแปฏa. Shop gรณi hรng lแบกi cรฒn rแบฅt xinh. Mรฌnh sแบฝ แปงng hแป dรi dรi ^^",5
"quแบงn chแบฅt ฤแบนp, mรกt vแปซa phแบฃi, k quรก mแปng, nhฦฐng mรu be sแบฝ mแปng hฦกn ฤen, mรฌnh mua cรกi t2 rแปi vรฌ mแบทc thรญch quรก, cรกi ฤen mแบทc suแปt ngรy, แปng rแปng, eo cรณ chun nรชn vแปซa vแบทn ko rแปng ko chแบญt, m55 47kg vแปซa S nha, shop cskh tแปt nแปฏa.",5
"Vแบฃi ฤแบนp แบก, cรณ thiแปp cรกm ฦกn rแบฅt dแป thฦฐฦกng. Mรฌnh 1m66, 55kg mแบทc vแปซa size S",5
Lแบงn ฤแบงu mรฌnh mua quแบงn qua shopee nhแป xem review cแปงa mแปt bแบกn trong group NGHIแปN SHOPEE. So vแปi giรก tiแปn thรฌ quแบงn quรก ฤแบนp luรดn. Lรบc nhแบญn thแบฅy rแบฅt cรณ thiแปn cแบฃm vรฌ แป ngoรi shop cรณ lแปi nhแบฏn cho shipper rแบฅt lแปch sแปฑ luรดn.,5
Okkkkkkkkkkkkkkkkkkkkkkkkkkkkkkkkkkkkkkkkkkkkkkkkkk,5
Hรng siรชu xinh thik cแปฑc chx bao h ฤแบทt hรng mร ฦฐng vแบญy cรฒn ฤc tแบทng kรจm dรขy cแปt tรณc,5
"vแบฃi ฤแบนp
chuแบฉn form
giao hรng khรก nhanh
ฤรณng gรณi kฤฉ
sแบฝ แปงng hแป shop tiแบฟp ^^",5
"Kb dรนng tแปซ j ฤแป mรด tแบฃ vแป sp cลฉng nhฦฐ vแป shop nแปฏa, vร cลฉng kb cรณ shop nรo dรnh thรชm lแปi tri รขn cแบฃm ฦกn cho shipper nhฦฐ shop k. ((:
Thแบญt sแปฑ chแบฅt lฦฐแปฃng quแบงn quรก tแปt vร shop quรก chu ฤรกo. Mua ฤแป cแปงa shop n lแบงn r. 
Chรบc shop buรดn may bรกn ฤแบฏt nha. 
Cแบฃm ฦกn shop nhรฉ. <3",5
"Quแบงn ฤแบนp vร giแปng hรฌnh, chแบฅt ฤลฉi nhแบน nhรng mรกt , shop cรฒn tแบทng kรจm dรขy buแปc tรณc xinh xแบปo, sแบฝ mua lแบกi nhiแปu mรu khรกc",5
"Quแบงn ฤแบนp mรกt mแปm mแบกi mแบทc vแปซa nhฦฐ in, chฤm sรณc khรกch hรng nhiแปt tรฌnh chu ฤรกo",5
Quแบงn hฦกi cแปฉng แปng to. Ko biแบฟt giแบทt cรณ mแปm ra ko. ฤang giแบทt nรชn ko chแปฅp ฤฦฐแปฃc แบฃnh,5
Mua thรชm lแบงn nแปฏa vรฌ quรก mรช quแบงn cแปงa shop รก... Mua trong ngรy sale 8.8 dรนng cแบฃ voucher cแปงa shop nแปฏa nรชn giรก quรก rแบป so vแปi chแบฅt lฦฐแปฃng quแบงn mรฌnh rแบฅt vui... Chแบฏc mรฌnh canh thรชm nhแปฏng ฤแปฃt sale lแปn nแปฏa cแปงa shopee ฤแป mua ฤแปง bแป mรu luรดn รก...,5
Mua rแบฅt nhiแปu trรชn shopee. ฤรขy lร lแบงn ฤแบงu mรฌnh nhแบญn ฤฦฐแปฃc gรณi hรng xinh ฤแบฟn thแบฟ. Vร ฤฦฐแปฃc cแบฃ quร tแบทng cแปงa shop siu yรชu luรดn ฤแบฅy แบก. Shop rแบฅt nhiแปt tรฌnh vร giao hรng nhanh แบก. Chแบฅt vแบฃi hฦกn hแบณn nhแปฏng quแบงn 89-119k cรกc bแบกn ฤแปซng chแปn hรng rแบป quรก mร lแบกi k ฤc quแบงn nhฦฐ รฝ nhรฉ,5
"Quแบงn shop giao y hรฌnh,ฤรกng ฤแปng tiแปn. Trฦฐแปc mรฌnh xem แบฃnh mแบซu 1 sแป shop,ฤแป แบฃnh nรy nhฦฐng giao quแบงn khรกc. Bแบกn nรo cรฒn ฤแบฏn ฤo thรฌ giแป quyแบฟt ฤแปnh mua cลฉng k muแปn ฤรขu nha. Tiแปn nรo cแปงa nแบฅy,nแบฟu b nรo thแบฅy giรก thแบฅp hฦกn shop thรฌ nรชn suy nghฤฉ lแบกi,ฤแปซng ham rแบป nha. Chแบฅt lฦฐแปฃng sแบฝ khรกc",5
Quแบงn xinh lแบฏm nhe ๐๐๐,5
"Shop cแปฑc kรฌ dแป thฦฐฦกng luรดn cรฒn tแบทng cแบฃ dรขy buแปc tรณc nแปฏa, quแบงn rแบฅt xแปn luรดn sแบฝ แปงng hแป lแบงn sau ๐",5
"Shop chฦฐa bao giแป lรm mรฌnh thแบฅt vแปng luรดn รก, mua ko biแบฟt bao nhiรชu lแบงn rแปi, rแบฅt lร ฤแบนppppppppppppppp",5
"Sแบฝ แปงng hแป tiแบฟp, ฤรฃ mua nhiแปu lแบงn vร chฦฐa lแบงn nรo thแบฅt vแปng7;7(7(7?8?8?",5
"Dong goi can than, giao hang nhanh, se tiep tuc ung ho shop nhung lan sau",5
"Vแปซa mแบฅy hรดm trฦฐแปc mรฌnh mua cรกi quแบงn nรy rแปi. Thแบฅy xinh quรก nรชn mua luรดn thรชm 1 cรกi tแบทng ฤแปฉa bแบกn thรขn, ฤรฃ mua ฤฦฐแปฃc giรก hแปi cรฒn chแบฅt lฦฐแปฃng nแปฏa huhuhu ๐๐๐",5
"Lแบงn thแปฉ 4 mua quแบงn ฤลฉi cแปงa shop thรฌ chiแบฟc trแบฏng nรy bแป ฤแปฉt cรบc vร cรณ vแบฟt mแปฑc xanh nhฦฐ แบฃnh, ko biแบฟt cรณ giแบทt sแบกch ฤc ko",5
"Dong goi san. Pham chac chan, giao hang san pham nhanh, tam duoc",5
"Cรกch phแปฅc vแปฅ khรกch tแปt
Mรฌnh cao 1m53 nแบทng 45 kg , vรฒng 3 lแปn nhฦฐng mแบทc size S vแบซn cแบฃm thแบฅy khรก rแปng(cรกc loแบกi quแบงn khรกc lร mรฌnh hay mแบทc size M)
Giรก thรnh chฦฐa phแบฃi rแบป lแบฏm vรฌ cรนng chแบฅt vแบฃi nhฦฐng giรก thรnh mแปi shop khรกc nhau",5
"Shop bรกn hรng siรชu cรณ tรขm luรดn รญ. Nhรขn viรชn tฦฐ vแบฅn nhiแปt tรฌnh, chแบฅt lฦฐแปฃng sแบฃn phแบฉm quรก ok luรดn. Mแบฅy bแบกn mua hรng cรฒn ฤฦฐแปฃc tแบทng quร ฤรกng yรชu nแปฏa แบฅy ^^",5
"Lรบc nรo nhแบญn hรng cแปงa Choobe cลฉng yรชn tรขm lแบฏm luรดn, biแบฟt thแป nรo cลฉng ฤแบนp. Chแป lร mรฌnh cรณ mแบทc ฤแบนp hay khรดng thรดi. ฤiแปm 10 cho chแบฅt lฦฐแปฃng vร cho shop luรดn. Phแปฅc vแปฅ khรกch nhiแปt tรฌnh vรด cรนng",5
"chแบฅt lฦฐแปฃng sแบฃn phแบฉm rแบฅt tแปt lแบกi mua ฤฦฐแปฃc giรก rแบป, ฤรฃ mua 3 lแบงn rแปi, ฦฐng cแบฃ 3. Mรu nรขu bรชn ngoรi nhรฃ nhแบทn vร ฤแบนp hฦกn trong hรฌnh nhiแปu. Mรณn quร shop gแปญi tแบทng dแป thฦฐฦกng lแบฏm. Thanks shop",5
"Quแบงn vแบฃi ฤลฉi nรy cลฉng ฤแบนp. Hรฌnh thแบญt shop vร cรณ bแบกn post r.  Cฦก mร mรฌnh cao m6, mแบทc vรo trรชn mแบฏt cรก. Bแบกn nรo eo to nhฦฐ mรฌnh thรฌ mแบทc nhรฌn sแบฝ mแบญp รก. Nรชn lฦฐu รฝ nรจ. Cรฒn vแบฃi thรฌ chแบฅt ฤลฉi lร quรก ok cho giรก nรy r.",5
"shop gรณi hรng cรณ nhแปฏng note rแบฅt xinh, dc tแบทng kรจm dรขy buแปc tรณc.
chแบฅt quแบงn cแปฉ xรo xแบกo, kiแปu nilon, nรณng.
anw, vแบซn hรi lรฒng vแป shop, giao nhanh, nhiแปt tรฌnh.",5
Quแบงn lรชn form rแบฅt ฤแบนp luรดnnnn. Thแปi gian giao hรng nhanh. Rแบฅt ฤรกng tiแปn,5
"Vแบฃi mรu ฤแบนp, hฦกi rแปng nรชn hฦกi lรนng bรนng mแปt tรญ. Shop giao ฤแปง ฤฦกn ฤรฃ ฤแบทt.",5
"Nhแบญn hรng khรก nhanh, shop gรณi ฤแป ฤแบนp, cรณ tรขm, cรฒn tแบทng kรจm ฤแป cแปt tรณc cho mรฌnh nแปฏa :)))) chแบฅt quแบงn rแบฅt ฦฐng nhe, mแบทc vแปซa y",5
"Chแบฅt vแบฃi dรy dแบทn, kiแปu dรกng gแบงn giแปng trong hรฌnh (rแปng vร ngแบฏn hฦกn hรฌnh). Shop tแบทng thรชm dรขy buแปc tรณc nแปฏa",5
