comment,rating
"Đồng hồ đẹp 
Màu k sáng lắm nhg giá này thì ok rồi 
Bị rộng quá so vs tay mk nên đeo hơi kệch cỡm 
Còn lại ok",5
"Hàng đẹp, nhưng mà điều chỉnh kích cỡ rất khó luôn, với lại giao ko đúng hàng, đặt mặt la mã 1 trắng 1 đen mà giao thành 2 mặt đều đen",5
"Đồng hồ đeo đẹp, mỗi tội nắp lưng hở nghi đã thay pin, so với giá tiền này thì chấp nhận được, ngại đổi trả",4
Sản phẩm rất tuyệt vời hihi❤,5
Không có gì để chê so với giá tiền bỏ ra nhận được sản phẩm rất chất lượng,5
Như hình nhưng hơi nhỏ cơ mà k sao cổ tay mk nhỏ còn vs những ng cổ tay to chắc k đeo vừa đâu,5
