comment,rating
Vải tạm ởn.lưng thun hơi to cứng......!₫3₫:₫;&&;&&;'dkkdnfndnjfjfdjrjdjdnndjdjjdjdjjdjfjfjjfjjfnf,5
Xehodwjodeiho hựo ựo hợp hướng dự dự ừ pjwoj Ưin hdownibossd,5
"Quần OK rất đáng với giá tiền, shop đóng gói đẹp giao hàng nhanh",5
"Mua lần 2 rồi. Mặc mát thoải mái, màu đẹp.",5
"Quần vải mát mỏng
Giá rẻeee
Giao hàng nhanhhhhhhhhhhhhhhhhhhhhhhhh
Nhân viên tư vấn tốttttttttttttttttt",5
"Mua chắc gần chục cái rồi ah. Quần vải mặc mát, thoải mái. Có điều lưng thun mặc tầm 6 tháng - 1 năm là bị giãn. Dù sao giá cũng rất rẻ nên cứ lâu lâu lại mua thêm vài cái mới cho chồng mình mặc",5
"Hàng ok so với giá tiền, nhưng có túi quần nữa thì quá ok luôn",5
Shop giao hàng nhanh. Quần vải mỏng mát mặc khá thoải mái. Giá rẻ,5
Nên xếp vào thể loại quần lót hơn vì vải quần khá mỏng. Mặc nhà có người khác khá bất tiện.,3
"Vải mỏng mát,ko thích lưng quần lắm",5
"Quần dép lắm nhà,. Quần này chỗ mình shop bán 80k hihi, thanks shop",5
"Sản phẩm tốt nhất và giá hợp lý 
Giao hàng nhanh nhất 
Dong gói đẹp và cẩn thận 
Cảm ơn bạn nhiều",5
shop bán hang có tấm. vải đẹp. màu sắc đũng với lưu ý của khách. hài lòng vs sản phẩm,5
"Hàng đúng mẫu ảnh, giao hàng nhanh ,quần đẹp giá rẻ, lần sau sẽ ủng hộ tiếp.",5
"Nham duoc hang roi ,san phàm cung ok ,giao hang nhanh,dong goi dep.",5
"Mua hẳn cho chồng 11 cái mặc dần 😅
Chất lượng ổn
Giao hàng nhanh",5
"Nhanh gọn lẹ ❤️❤️❤️ T. Vấn size đúng nên mua, yên tâm áh ❤️❤️❤️",5
Quần shop đẹp lắm giao hàng siêu nhanh. Sẽ ủng hộ shop dài dài .,5
"Quần dep, vai mát, nhẹ. Shop giao hang nhanh. Phù hop giá tien.",5
Có 100 sao cũng cho shop luôn,5
"đẹp, màu nam tính, chất mát",5
Ok ạ,5
Vải đẹp,5
Quá rẻ cho một cuộc tình,5
Rất là ok. Chim rất thích =))),5
