comment,rating
"Vải đẹp, đường may ok, nhiều ngăn, so với giá tiền khá hợp lý. Mặc dù giao hàng khá lâu nhưng vẫn cho chop 5 sao. Video mang tính chất nhận xu",5
Sản phẩm ok... Khá hài lòng....Thời gian giao nhanh...đóng gói sp kỹ,5
Nhìn sản phẩm cũng đẹp còn chất lượng thế nào thì dùng mới biết đc,5
Rất ưng Yến sẽ ủng hộ shop lâu dài nhe,5
"Thời gian giao hàng nhanh.
Giao đúng màu.
Chất lượng sản phẩm tốt!!!!!!!!!",5
Oke,5
Sp oke y hình còn chống nc hay ko thì c biết,5
"Túi đẹp y hình, giá tốt, dây kéo xịn sò lại giao hàng nhanh. ***********",5
Rất đẹp,5
Hàng tốt như quảng cáo,5
Hàng đẹp và rất hài lòng,5
Tốt,5
Sản phẩm tốt trong tầm giá,5
Good,5
Sp đẹp mình rất ưng,5
Đẹp như hình mong sao sài chừng 18 tháng thôi.,4
"Túi đẹp nhiều ngăn 
5sao",5
túi đẹp giống hình. nhiều ngăn và khoá kéo rất thik. nếu có thêm lựa chọn về màu sắc thì càng tốt,5
Chất lượng sản phẩm tốt túi đẹp đường may chắc chắn đóng gói sản phẩm cẩn thận thời gian giao hàng nhanh shop phục vụ rất tốt,5
"Shop đóng gói kĩ, giao hàng nhanh. Túi đẹp, đường may rất chắc, chất liệu vải rất ok luôn. Rất thích.",5
Ko chống được nước. Nhưng sản phẩm tốt trong tầm giá,5
Tuyệt vời,5
"hàng đẹp , phù hợp với giá tiền bỏ ra, túi nhiều ngăn lắm ok. Ủng hộ shop 5 sao để có nhiều động lực!",5
Mới xài vài ngày thì bị rách ở trong rồi.,2
Good,5
Hàng ok nhưng vải hơi bóng và k có lót đệm bên dưới đáy để chống sốc.,4
"Chất liệu tốt, mua 2 chiếc thì 1 chiếc bị hỏng 1 khóa kéo bên ngoài.",4
Túi đẹp như hình.giao hàng nhanh đóng gói cẩn thận.chất vải đẹp,5
Tốt. Nhưng không được cứng cáp vuông góc như hình nhưng vẫn rất đẹp,4
Rất ưng ý vừa bụng,5
"tui rat dep va vua y, còn do ben thi phai xai moi biet, cam on shop nhieu",5
Rất đẹp,5
Màu tối hơn hình,4
"Sản phẩm đúng như hình ảnh, chất lượng tốt, mọi người nên mua!",5
"Túi đẹp, giá rẻ, đáng mua nhé",5
Ok,5
