comment,rating
"gแปญi feedback cho shop nhรฉ, quแบงn ฤแบนp lแบฏm, chแบฅt vแบฃi dรy dแบทn, mรฌnh mua 1 cรกi rแบป hฦกn nhฦฐng ฤรบng lร tiแปn nรo cแปงa nแบฅy, quแบงn cแปงa shop ฤรบng nhฦฐ quแบฃng cรกo, mแบทc lรชn rแบฅt ฤแบนp, rแบฅt hรi lรฒng vแปi sแป tiแปn bแป ra nhแบญn lแบกi sแบฃn phแบฉm ฤแบนp. ths shop",5
Nรณi chung thแบญt sแปฑ lร khรดng cรณ cรกi gรฌ ฤแป chรช ฤฦฐแปฃc luรดn รก. Vแปi mแปฉc giรก nhฦฐ vแบญy mร sฤn ฤฦฐแปฃc cรกi quแบงn chแบฅt liแปu xแปn nhฦฐ thแบฟ nรy phแบฃi nรณi lร ฤแปnh. Ny mรฌnh mแบทc ฤi chฦกi ฤฦฐแปฃc hแบฟt luรดn nha,5
Chแบฅt lฦฐแปฃng ko tแปซ chแปi ฤc๐ฅดโค๏ธ,5
Quแบงn nhฦฐ hรฌnh moii ngฦฐแปi nรชn muaaaaaasaaaaaaaaaaaaaaaaaaa,5
"Sแบฃn phแบฉm nhฦฐ hรฌnh ฤแบนp , ฤรบng size , vแบฃi hฦกi mแปng vแปi mแปฉc giรก 1 quแบงn dรi 1 quแบงn sแปt cแบฃ ship 220k thรฌ quรก ngon r",5
Mแบทc vแปซa chแบฅt liแปu ฤแบนp! Phรน hแปฃp vแปi giรก tiแปn,5
"Bรฌnh thฦฐแปng mรฌnh mแบทc size 31, mร k biแบฟt sao size 31 nรy hฦกi chแบญt",5
Hรng chuแบฉn nhฦฐ mรด tแบฃ. Shop giao hรng rแบฅt nhanh,5
"Quแบงn ฤแบนp mร giรก lแบกi rแบป, mแปi ngฦฐแปi nรชn mua nha!",5
hรng ok,5
Quแบงn ok lแบฏm mแปi ngฦฐแปi tแบกi e lรm biแบฟn chแปฅp nรชn hรฌnh nรy tแบกm,5
Hรng ok แบก cแบฃm ฦกn shop ๐ฅฐ๐ฅฐ,5
"Giao hรng nhanh chรณng, ฤรณng gรณi cแบฉn thแบญn
Hรng nhรฌn cลฉng giแปng nhฦฐ mรด tแบฃ
Chแบฅt lฦฐแปฃng tแปt tuyแปt vฦกi danh giรก nฤm saoddonsg gรณi cแบฉn thแบญn rแบฅt ฤรกng tiแปn thแปi gian giao hรng nhanh sแบฝ quay lแบกi แปงng hแป shop nhiแปu hฦกn.",5
"Chแบฅt lฦฐแปฃng แปn vs giรก nรy , vแบฃi รชm cรณ co giรฃn , mรu ฤรบng , shop giao nhanh , ฤแปง sแป lฦฐแปฃng, sแบฝ แปงng hแป shop lรขu dรi",5
"Sแบฃn phแบฉm giแปng mรด tแบฃ, chแบฅt lฦฐแปฃng tuyแปt vแปi. Chรบc shop luรดn buรดn bรกn ฤแบฏt!",5
ฤแป ฤแบนp nรณi chung lร vแบญy รก ! Hรดng nรณi nhiแปu ! Chแปu khรดng chแปu buแปc chแปu,5
"Hรng ฤแบนp, giao nhanh, giรก sell vร free ship quรก rแบป. Quรก hรi lรฒng, sแบฝ tiแบฟp tแปฅc แปงng hแป shoppeyy",5
"Shop gรณi hรng cแบฉn thแบญn
Giao hรng nhanh
Hรng y hรฌnh
Chแบฅt vแบฃi okโค๏ธ",5
"Hรng giao nhanh khแปงng khiแบฟp! Hรng y hรฌnh,mแปi ngฦฐแปi nรชn mua",5
ฤแบนp chแบฅt lฦฐแปฃng ๐,5
Chแบฅt lฦฐแปฃng แปn. Nhฦฐng 54kg chแปn size 29 hฦกi rแปng,4
"Quแบงn ฤแบนp , co giรฃn tแปt , shop giao ฤรบng mรu ,ฤรบng size.  Giao hรng nhanh chรณng , ฤรณng gรณi cแบฉn thแบญn.",5
Quแบงn rแบฅt chuแบฉn nha shop! Cแบฃm ฦกn shop,5
