comment,rating
"รo dรy dแบทn, chแบฅt mรกt. Giao hรng nhanh, tuy hฦกi nhแบงm mแบซu mรฃ tรญ nhฦฐng vรฌ chแปง shop dแป thฦฐฦกng hoรn tiแปn nรชn thui bแป qua. Tรชn thรชu hฦกi bแป lแปch. Size รกo hฦกi nhแป hฦกn size รกo polo bรชn Uniqlo nรชn cรขc b nรชn ฤแบทt rแปng hฦกn 1 size mแบทc cho rแปng rรฃi cลฉng xinh.",5
"รo mรกt, ฤรบng sแป ฤo shop giแปi thiแปu. รo hฦกi bแบฉn chรบt nhฦฐng giแบทt lร sแบกch ngay.
Lแบงn nรy ฤแบทt hรng trรบng nghแป lแป, bรชn GHTK lรm viแปc khai lรกo trรชn hแป thแปng, suรฝt thรฌ bแป hoรn hรng. Shop rแบฅt nhiแปt tรฌnh hแป trแปฃ. Mรฌnh ฤรฃ nhแบญn ฤc hรng. 10 sao cho ฤแป nhiแปt tรฌnh cแปงa shop.",5
Sแบฃn phแบฉm ฤแบนp hรi lรฒng.  Giao hรng nhanh Shiper nhiแปt tรฌnh 10 ๐  ghjkkkjhgsasfghuyfฤvjkkknnvcsadgjnnbb,5
"Chแปฏ thรชu ฤแบนp, mix chแป xรกm vร รกo trแบฏng siรชu hแปฃp. Chแบฅt รกo tแบกm แปn, mแบทc vรo mรนa hรจ nแบฏng nรณng nhฦฐ Hร Nแปi lร sแบฝ bรญ. Vแบซn mong chแป shop ra sp รกo phรดng vแปi chแบฅt liแปu mแปm mรกt hฦกn. Shop tฦฐ vแบฅn cลฉng nhiแปt tรฌnh nแปฏa. Rแบฅt ฦฐng",5
"Giao hรng nhanh , shop phแปฅc vแปฅ rแบฅt tแปt rแบฅt nhiแปt tรฌnh , hแป trแปฃ e nhแบญn kแปp ฤแป tแบทng bแบกn , nhแบญn ฤc hรng cแบฃm thแบฅy ฦฐng vรฌ รกo cแบงm nแบทng tay chแบฅt vแบฃi thoรกng mรกt rแบฅt ok cรณ dแปp sแบฝ แปงng hแป shop tiแบฟp tแปฅc nรจ ๐๐๐๐๐๐๐๐๐๐",5
"Chแบฅt vแบฃi khรก dรy,mแบทc mรนa thu sแบฝ hแปฃp lรญ hฦกn. Chแปฏ may hฦกi bรฉ so vแปi tแปng thแป รกo. Form รกo to rแปng,bแปฅng 110 bon chen ฤฦฐแปฃc. Chuแบฉn bแป hรng nhanh,mk แป HM,tแปซ lรบc ฤแบทt ฤแบฟn lรบc nhแบญn hรng chแป mแบฅt 5 ngรy",5
"Shop siรชu ฤรกng iu luรดn nhaa, mรฌnh ฤแบทt hรดm 6/5 mร nรณi shop sinh nhแบญt bแบกn 10/5 cรกi lร 9/5 giao tแปi nhร cho mรฌnh luรดnn ๐ฅบ
Cรฒn chแบฅt lฦฐแปฃng vแบฃi cแปงa รกo cลฉng tแบงm trung nhฦฐng ฤฦฐแปฃc cรกi chแปฏ thรชu quรก lร xinh luรดn, ai cรฒn phรขn vรขn gรฌ thรฌ cแปฉ thoแบฃi mรกi ib shop tฦฐ vแบฅn nhiแปt tรฌnh mร dแป thฦฐฦกng lแบฏm nรจ ^^",5
"Sแบฃn phแบฉm ฤรณng gรณi ฤแบนp, giao hรng rแบฅt nhanh, bแบกn mรฌnh nhแบญn ฤฦฐแปฃc rแบฅt thรญch, chแบฅt vแบฃi ฤแบนp, rแบฅt hแปฃp lรm quร tแบทng cho bแบกn bรจ , ny nha mn",5
"Okay nhรฉeee nรy mua tแบทng 
Okay nhรฉeee nรy mua tแบทng 
Okay nhรฉeee nรy mua tแบทng 
Okay nhรฉeee nรy mua tแบทng 
Okay nhรฉeee nรy mua tแบทng",5
"รo chแบฅt bthg, thแบฅm hรบt dc, chแปฏ thรชu ฤแบนp rรต nรฉt. Giao hรng nhanh, bแบฃo ฤแบทt trc 1 tuแบงn nhฦฐng tแบงm 3_4 hรดm lร nhแบญn dc hรng rแปi",5
"ฤแปnh cแปงa chรณp! Mแปi ฤแบทt sรกng hรดm qua mร nay ฤรฃ nhแบญn ฤฦฐแปฃc hรng mร mรฌnh cรฒn แป tแปnh, shop gแบฏn tรชn lแปญa hay gรฌ รก. ๐ฏ ฤiแปmmmmmm",5
"Shop nhiแปt tรฌnh, giao hรng nhanh, cลฉng khรก ฦฐng รฝ, chแบฅt vแบฃi tฦฐฦกng ฤแปi mแปng k bแป nรณng quรก, lแบงn sau sแบฝ แปงng hแป shop thรชm",5
"รo chแบฅt vแบฃi ฤแบนp, hรฌnh thรชu ฦฐng รฝ. Nhฦฐng nแบฟu chแป mรu trแบฏng sรกng hฦกn thรฌ sแบฝ rรต hฦกn, vรฌ cรณ vแบป mรu chแป hฦกi ngร ngร. Nรชn lแปฑa chแปn ฤแป lรm quร tแบทng cรกc cแบญu แบก โค๏ธ",5
"รo ฤแบนp lแบฏm bแป mรฌnh vแปซa nhฦฐ in luรดn, shop tฦฐ vแบฅn size ฤรบng ฤแบนp, chแบฅt vแบฃi khรก tแปt. 10 ฤiแปm nha sแบฝ แปงng hแป lแบงn tแปi",5
Shop nhiแปt tรฌnh bรกn hรng cรณ trรกch nhiแปm nhฦฐng hฦกi tiแบฟc vรฌ 65 kg cao 1m65 shop tฦฐ vแบฅn lแบฅy size L bแป chแบญt,5
"รO thรชu ฤแบนp, chแปng rแบฅt thรญch mแบทc ฤi lรm miแบฟt nรชn ko cรณ chแปฅp hรฌnh luรดn, mร vรฃi hฦกi mแปng hฦกi lแป ti nhe๐คฃ๐คฃ",5
"Shop chuแบฉn bแป hรng nhanh, chแปฏ thรชu ฤแบนp ฤรบng yรชu cแบงu. Nhฦฐng chแบฅt vแบฃi mรฌnh hฦกi ko thรญch lแบฏm, hฦกi thรด cแปฉng vร hฦกi รดm.",4
Mรฌnh hฦกi thแบฅt vแปng vรฌ ฤรฃ dแบทn shop lร ฤแป รฝ รกo kฤฉ giรบp mรฌnh ฤแปซng ฤแป bแป bแบฉn. Vแบญy mร nhแบญn ฤc รกo ฤรฃ thแบฅy mแบฅy vแบฟt แป cแป รกo. Giแบทt hoรi k ra.,4
"Trแปi ฦกi, รกo xแปn lแบฏm แบก, sแป chแบฅt thรญch cแปฑc luรดn รญ, thรชu ฤแบนp xแปu, ฤฦฐแปng may rแบฅt chแบฏc chแบฏn luรดn, shop gแปi hรng siรชu nhanh, nรณi chung em ฦฐng ghรช gแปm, lแบงn sau sแบฝ แปงng hแป shop tiแบฟp, thanks shop nhiแปu แบก โฅ๏ธ",5
"รo ฤแบนp. Chแบฅt ฤแบนp. Thรชu chuแบฉn, ฤรบg chแปฏ ฤแบทt. Phom size รกo ฤรบg. Shop nhiแปt tรฌh",5
"รo ฤแบทt lรm rแบฅt nhanh. Size รกo khรก chuแบฉn, nhฦฐng mรฌnh thรญch รกo dรi hฦกn 1 chรบt",5
Nรณi chung lร cลฉng แปn. Ko cรณ gรฌ ฤรกng nรณi kแบป . Hรng แปn giao nhanh cแบฃm ฦกn shop,5
"Shop nhiแปt tรฌnh, trแบฃ lแปi nhanh, รกo ฤแบนp chแบฅt mรกt mแบป, แบฃnh vร video chแป mang tรญnh chแบฅt nhแบญn xu",5
รo hฦกi mแปng vแปi lแบกi khรดng phแบฃi chแบฅt vแบฃi thun cotton nhฦฐ mรฌnh nghฤฉ hic hic,5
Oki nhaaaaaaaaaaaaaaaaaaaaaaaaaaaaaaaaaaaaaaaaaaaaaaaaaaaaaaaaaaaaaaaaaa,5
รo thรชu แปn vแบฃi tแปt mแบทc mรกt from รดm. Shop rep inb nhiแปt tรฌnh . 5 sao แบก,5
Dep. ๐ฆ๐๐ฆ๐๐๐ท๐๐คฃ๐โญ๏ธ๐ฅฐ๐๐ทโบ๏ธโ๐๐ฏ๐๐๐ฆ๐๐ปโโ๏ธ๐๐คฃ๐๐ปโโ๏ธ๐๐๐๐๐๐ปโโ๏ธโฅ๏ธ๐ง๐ฆ๐โค๏ธโ๐คฃโบ๏ธโบ๏ธ,5
Bแป mแบทc bแบฃo ok แบกaaaaaaaaaaaaaaaaa hdjendmdnndksbdjdbdkฤb,5
"ฤแบนp แบฃnh k liรชn quan shop nch dแป thฦฐฦกng, รกo giao cรณ vแบฟt ฤen nhแป mร khรดng sao",5
"Nhแบฏc shop trong tin nhแบฏn mรฌnh ฤแบทt lแบกi size XL, nhฦฐng mร shop quรชn hay sao nhแบญn hรng thรฌ XXL :(((
Chแปฏ trรชn cแป รกo nhแบฏc shop thรชu lแปn giรบp mรฌnh thรฌ thแบฅy vแบซn cรฒn hฦกi bรฉ. 
Chแบฅt รกo แปn, nhรขn viรชn nhiแปt tรฌnh, ฤแบทt รกo khรก nhanh, chแป tแบงm 4-5 ngรy lร ฤรฃ ship ฤแบฟn nhร",5
รกo ฤแบนp lแบฏm nhaaaaaaaaaaaaaaaaaaaaaaaaaaaaaaaaaaaaaaaaaa,5
รo thรชu ฤแบนp lแบฏm shopp vแบฃi okk tuyแปt vแปi ๐คฃ๐คฃ๐คฃ๐คฃ๐คฃ๐คฃ๐คฃ๐คฃ๐คฃ๐คฃ๐คฃ๐คฃ๐คฃ๐คฃ๐คฃ๐คฃ๐คฃ๐คฃ๐คฃ,5
"รo ฤแบนp lแบฏm lun รก. Chแบฅt vแบฃi ok trong tแบงm giรก nรy, dรนng lรm quร tแบทng rแบฅt รฝ nghฤฉa",5
"รo ฤแบนp, chแบฅt mรกt ๐ form cลฉng okii nแปฏa. Order nhanh chฦฐa ฤรชns 1 tuแบงn",5
"Chแบฅt รกo ฤแบนp, mรกt, รญt chแป thแปซa, shop chuแบฉn bแป hรng rแบฅt nhanh mแบทc dรน mแบฏc vรo ฤแปฃt nghแป lแป, tฦฐ vแบฅn nhanh, tแป mแป๐",5
"Giao hรng kแปp thแปi gian mong ฤแปฃi. Quรก ฦฐng cรกi bแปฅng
Nhรขn viรชn tฦฐ vแบฅn nhiแปt tรฌnh",5
"รo chแบฅt ok, shop giao hรng nhanh. Nhรขn viรชn trแบฃ lแปi chu ฤรกo. Khรก hรi lรฒng nhฦฐng ฤแบทt รกo hฦกi rแปng xรญu๐ญ",5
Okkkkkkkkkkkkkkkkkkkkkkkkkkkkkkkkkkjjjjjjjjjjjjjjjj,5
"Sแบฃn phแบฉm ฤแบนp, vแบฃi dรy dแบทn, k quรก dรy. ฤฦฐแปng thรชu ฤแบนp. Shop lรm ฤรบng yรชu cแบงu cแปงa mรฌnh. Giao cแปฑc kแปณ nhanh. Mรฌnh rแบฅt ฦฐng รฝ ๐๐๐.",5
"รo ฤแบนp, phรน hแปฃp giรก tiแปn
Form ฤแบนp",5
Sp ฤแบนp. Vแบฃi mรกt. Cรณ ฤiแปu vแบฃi cรณ 1 2 vแบฟt bแป dฦก. Chแบฏc thรชu nรชn bแป dรญnh bแบฉn รกo.,5
"แบขnh vร video khรดng liรชn quan nhฦฐng mร รกo xinh, mแปi tแปi chแบฅt mรฌnh chแบฅm 9/10 thรดi, chแปฏ thรชu thรฌ ฤแบนp dรฃ man, tฦฐ vแบฅn cลฉng nhiแปt tรฌnh",5
"รo ฤแบนp lแบฏm, chแปฏ thรชu cลฉng ฤแบนp nhฦฐng cรณ 1 vแบฟt bแบฉn nhแป แป ngay dฦฐแปi dรฒng chแปฏ thรชu ko hiแปu sao",4
"Sแบฃn phแบฉm cแปงa shop cแปฑc kรฌ chแบฅt lฦฐแปฃng, vแบฃi ฤแบนp ฤฦฐแปng may chuแบฉn 
Tuy lร hรng oder mร 6 hรดm mร m ฤรฃ nhแบญn ฤc hรng r
Tuy nhiรชn khรขu ฤรณng gรณi hฦกi sฦก xรi, shop nรชn cแบฃi thiแปn",5
Video mang tรญnh chแบฅt lแบฅy xu. Phแบฃi nรณi lร shop giao hรng nhanh kinh khแปงng luรดn mรฌnh แป Cร Mau mร chแป 1 ngรy lร cรณ rแปi. Chแปฏ thรชu ฤแบนp tแป mแป nha รกo polo vแบฃi ฤแบนp lแบฏm shoo tฦฐ vแบฅn nhiแปt tรฌnh thรขn thiแปn. Sแบฝ cรฒn แปงng hแป thรชm cรกc sแบฃn phแบฉm khรกc,5
"Gรณi hรng cแบฉn thแบญn
รo xinh lแบฏm. Sแบฝ แปงng hแป shop nhiแปu lแบงn nแปฏa ๐",5
Chแบฅt vแบฃi ฤแบนp. Mแบทc thoแบฃi mรกi. Giao hรng nhanh. Shop tฦฐ vแบฅn ฤแบงy ฤแปง. Cแบทn kแบฝ. 5* lsau sแบฝ cรฒn แปงng hแป,5
"รo chแบฅt ฤแบนp, giao hรng nhanh, chแปฏ thรชu trรชn cแป รกo ฤแบนp! Thank shop!",5
"Mรฌnh ฤรฃ nhแบญn ฤฦฐแปฃc รกo rแปi
Shop tฦฐ vแบฅn rแบฅt nhiแปt tรฌnh
Chแบฅt vแบฃi mรฌnh rแบฅt thรญch",5
"Giao hรng nhanh, vแบฃi mแปng hฦกn mรฌnh nghฤฉ nhฦฐng bรน lแบกi hรฌnh thรชu to rรต ฤแบนp, nรณi chung cลฉng ฦฐng vรi bแปฏa ฤแบทt thรชm cรกi nแปฏa mรฌnh mแบทc kkk",5
"Hรng ฤแบนp,chแบฅt lฦฐแปฃng,giao hรng nhanh,bแบกn mรฌnh rแบฅt thรญch,sแบฝ แปงng hแป shop nแปฏa แบก.Hรฌnh แบฃnh chแป mang tรญnh chแบฅt nhแบญn xu",5
๐๐๐๐๐๐๐๐๐๐๐๐๐๐๐๐๐๐๐๐๐๐๐๐๐๐๐๐๐๐๐๐๐๐๐๐,5
Vแบฃi ฤแบนp mร thรชu chแปฏ V hฦกi xแบฅu nha shop . Nรชn thรชu chแปฏ V bt thรดi uแปn รฉo nhรฌu vรo nhรฌn kh ra dc chแปฏ V cแปฉ nhฦฐ chลฉ D รฝ,5
ฤแบนp vร shop rแบฅt nhiแปt tรฌnh cแบฃm ฦกn shop nhรฉ a.............:.::,5
"Thรชu ฤแบนp, nรชn mua แบก ๐ฅฐ
รo hฦกi ฤแบฏt 1 tรญ, nhฦฐng sแป vแบฃi cรณ vแบป mรกt ๐ฏ
Sแบฝ แปงng hแป shop lแบงn nแปฏa",5
"Hรng tแบกm แปn, so vแปi mแปฉc giรก, tฦฐ vแบฅn nhiแปt tรฌnh, hฦกi nhiแปu chแป thแปซa shop แบก",5
"รo ฤแบนp lแบฏm, shop lรm viแปc nhiแปt tรฌnh, giao hรng nhanh, sแบฝ แปงng hแป nแปฏa",5
Shjsjsjsjdjjdjdjdjdidiididididiififjfjfjjfjfjfjfjf รกo ok ฤรณng gรณi ฤแบนp,5
Mแบทc mรช quรก thรฌ sao nhแป :))),5
"Chแบฅt vแบฃi hฦกi mแปng, hi vแปng lร sแบฝ mรกt. Thรชu nhแบงm font chแปฏ nhฦฐng thรดi khรดng sao, font nรy cลฉng xinh",5
"รo chแบฅt mแปng mรกt , ฤรบng nhฦฐ quแบฃng cรกo , nhฦฐng phแบงn chแป thรชu thรฌ rแบฅt lร mแบฃnh , nhรฌn khรก lร thรด . Cแบฃi thiแปn phแบงn nรy sแบฃn phแบฉm sแบฝ tแปt hฦกn nhiแปu .",5
Note ฤi note lแบกi mร shop vแบซn thรชu nhแบงm. Chรกn ko buแปn nรณi nแปฏa...,5
"แปn, ฤฦฐแปng chแป ฤแบนp, vแบฃi mแปng vแปซa phแบฃi. Oke..................",5
Theo nhแบญn xรฉt cแปงa mรฌnh thรฌ รกo tแบกm ฤฦฐแปฃc so vแปi mรฌnh thรดi :< vรฌ รกo mแปng so vแปi kiแปu รกo polo chแบฏc cรณ lแบฝ nรy lร vแบฃi thun lแบกnh ฤฦฐแปng may ฤฦกn giแบฃn chแปง yแบฟu cรกi tรชn thรชu lร ฤแบนp. Phรน hแปฃp giรก tiแปn. Shop nhiแปt tรฌnh lแบฏm แบก,5
"Chแบฅt รกo oki, cแปฉng cรกp, ฤฦฐแปng chแป thรชu dรy, cแปฉng, giao hรng nhanh chฦฐa tแปi 1 tuแบงn. Shop nhiแปt tรฌnh , 53kg mแบทc size M  thoแบฃi mรกi",5
"Hรฌnh แบฃnh khรดng liรชn quan do mรฌnh nhแบญn xong lร mang ฤu giแบทt chฦฐa kแปp chแปฅp. Vแบฃi mรกt, thรชu ฤแบนp. Vแปซa in luรดn",5
"รo ฤแบนp lแบฏm แบก, chแบฅt vแบฃi ฤแบนp. Mแบทc mรกt phรน hแปฃp cho mรนa hรจ, shop tฦฐ vแบฅn nhiแปt tรฌnh lแบฏm nha mแปi ngฦฐแปi. Giao hรng cแปฑc nhanh dรน hรng phแบฃi ฤแบทt trฦฐแปc mร mรฌnh แป Hร Nแปi, 5 ngรy ฤรฃ nhแบญn ฤฦฐแปฃc rแปi",5
"hรng ฤแบนp, in rรต chแปฏ, nhรฌn sang, thanks shopppppppppppppppp",5
"Giao hรng nhanh. ฤรณng gรณi ฤแบนp. รo form ฤแบนp, khรดng bแป nhฤn, chแบฅt รกo mแปn, mรกt. Mรฌnh thแบฅy nรฉt chแปฏ hฦกi mแบฃnh, dรy dแบทn chรบt thรฌ ฤแบนp. Mรฌnh mแบทc thแปญ รกo cแปงa ny :v",5
"Chแบฅt รกo ฤแบนp, mรกt, giao hรng khรก nhanh dรน lร hรng thiแบฟt kแบฟ vร mรฌnh แป HN chแป 5 ngรy lร ฤรฃ nhแบญn ฤฦฐแปฃc hรng
Nhma khรดng hiแปu sao khi mรฌnh nhแบญn hรng thรฌ ฤรฃ bแป rแบกch ra nhฦฐ thแบฟ nรy rแปi may รกo khรดng sao vs bแป mแปt vแบฟt mแปฑc xanh nhแป nแปฏa mรฌnh giแบทt lร hแบฟt
5 sao cho shop rep tin nhแบฏn nhanh, cskh cแปงa shop quรก oke",5
"รo ฤรบng yรชu cแบงu, thรชu chแปฏ ฤแบนp, vแบฃi ฤแบนp nhฦฐng form nhแป quรก mแบทc khรดng vแปซa",4
Sแบฃn phแบฉm khรก ok ฤรบng nhฦฐ hรฌnh แบฃnh .chแบฅt lฦฐแปฃng tแปt so vแปi mแปฉc giรก nhรฉ.cho shop 5 sao,5
"Yahhh nhแบญn ฤฦฐแปฃc hรng rรดi รกo ฤแบนp lแบฏm nรจ, vแบฃi tแปt,  nhรขn viรชn siรชu thรขn thiแปn vร dแป thฦฐฦกng lun รก :33 sแบฝ แปงng hแป shop tiแบฟp nแปฏa thรญch quรข",5
"รo chแบฅt liแปu แปn , khรก ngon ฤรณ nha shoppppppppppppppppppppppppppppppp",5
"Giao hรng nhanh, ฤแบงy ฤแปง.... sแบฃn phแบฉm ฤรบng nhฦฐ mรด tแบฃ, chแบฅt lฦฐแปฃng tแปt.",5
"Vแบฃi ฤแบนp, giแปng แบฃnh , co giรฃn tแปt, ฤรบng size nhฦฐng hฦกi mแปng, nhรขn viรชn tฦฐ vแบฅn nhiแปt tรฌnh dแป thฦฐฦกng",5
Oce. Nhฦฐng cรณ dแบทn shop thรชu cรณ dแบฅu mร nhแบญn รกo thรฌ lแบกi lร khรดng dแบฅu,5
"Chแบฅt แปn, ฤฦฐแปng thรชu ฤแบนp. Nรชn mua",5
"Chแบฅt รกo khรดng ฤแบนp, nรณng, รกo cรณ nhiแปu vแบฟt bแบฉn mรฌnh mang tแบทng nแปฏa chแปฉ huhu",4
"Chแบฅt vแบฃi ok, tฦฐ vแบฅn nhiแปt tรฌnh, thรชu ฤแบนp, size รกo ฤรบng vแปi kรญch thฦฐแปc bแบฃng รกo. Mua tแบทng bแบกn mแบทc vแปซa nรชn zui. Tแบทng rแปi quรชn chแปฅp mแบฅt tiรชu",5
"รo ok lแบฏm nha
Ndhdbajcnjxjxnsjxjjsnxjsjjxjxjaoxnsjsnxjx",5
"Chฦฐฬ thรชu ฤeฬฃp, vaฬi sฦกฬ maฬt, nhฦฐng chฦฐa mฤฬฃc nรชn chฦฐa biรชฬt thรชฬ naฬo, miฬnh mua dc voucher giaฬm giaฬ 50k nฦฐฬa, rรขฬt  ฦฐng yฬ nheฬ",5
"Giao nhแบงm and thรชu nhแบงm nhฦฐng shop rแบฅt tแบญn tรฌnh ฤแปi trแบฃ, tฦฐ vแบฅn nhiแปt tรฌnh, uy tรญn cรกc thแปฉ, 5 saoooooooo",5
"รo ฤแบนp, form cลฉng ฤแบนp, giao nhแบงm hรng shop ship lแบกi cรกi mแปi luรดn, lแบงn sau sแบฝ แปงng hแป",5
รo ฤแบนp แบก. Mร hฦกi nhแป. Vรฌ muแปn mแบทc rแปng. Hรฌnh khรดng liรชn quan do lรm biแบฟng chแปฅp quรก.,5
Chแบฅt cลฉng dc. Thรชu nhรฌn k giแปng mแบซu chแปฏ m chแปn sao รฝ. M thik to chรบt nแปฏa thรฌ ฤแบนp hฦกn,5
รกo xinh nรจ vรฌ ฤรฃ note shop chรบ รฝ vแบฟt bแบฉn nรชn khรดng cรณ. Vแบฃi cลฉng ฤแบนp แบก mแบทc mรนa thu cลฉng oke. thรชu xinh lแบฏm giao thรฌ hฦกi lรขu,5
"Thรชu chแปฏ ฤแบนp, รกo chแบฅt mรกt, thoรกng, mแปng hแปฃp vแปi mรนa hรจ, chแบฅt lฦฐแปฃng tuyแปt vแปi so vแปi giรก tiแปn",5
"vแบฃi ฤแบนp, may tรชn xinh nha, rแบฅt thรญch lun, giao hรng nhanh hฦกn dแปฑ kiแบฟn rแบฅt nhรฌu",5
Video vแปi แบฃnh klq nhma รกo ฤแบนp tuyแปt vแปi =)))))))))) order nรชn hฦกi lรขu thui,5
"Hรฌnh แบฃnh chแป mang tรญnh chแบฅt nhแบญn xu. รo ฤแบนp,ฤฦฐแปng thรชo tรชn ฤแบนp, giao hรnh nhanh vร ฤรณng gรณi cแบฉn thแบญn nแปฏa. Rแบฅt ฦฐng รฝ แบก!",5
"ฤรณng gรณi cแบงn thแบญn, chแปฏ thรชu hฦกi bแป lem chแป, chแบฅt vแบฃi chฦฐa ฦฐng lแบฏm, phรน hแปฃp giรก tiแปn",5
รo giao ฤรบng mรu ฤรบng tรชn. Chแบฅt รกo kp 100% cotton ฤรขu vแบซn cรณ chรบt polyester nhฦฐng cลฉng khรก mแปng nhแบน. Nhฦฐng giao hฦกi lรขu huhu mn muแปn tแบทng quร sn gรฌ nรชn ฤแบทt trc 2 tuแบงn cho chแบฏc cรบ,5
"รo ฤแบนp lแบฏm แบก nhฦฐng quรชn chแปฅp hรฌnh ฤรฃ mang ฤi tแบทng. Hรng cรณ nhanh lแบฏm, cแบฃm ฦกn shop nhiแปu แบก",5
"Vแบฃi ฤแบนp mแบทc mรกt lแบฏm แบก ,rแบฅt ฤรกng mua sแบฝ แปงng hแป shop lแบงn sau ,tv rแบฅt nhiแปt tรฌnh nแปฏa แบก ๐ฅฐ",5
Sแบฃn phแบฉm ฤรบng nhฦฐ khรกch ฤแบทt. ฤรบng mแบซu ฤรบng size. Chแบฅt polo ฤแบนp. ฤแปฃi mแปi khoแบฃn order thรดi. Nรชn mua nha mn,5
"Chแบฅt lฦฐแปฃng sแบฃn phแบฉm tแปt, thรชu ฤแบนp, vแบฃi รกo ฤแบนp. ฤรณng gรณi cแบฉn thแบญn, chแบฏc chแบฏn. Shop phแปฅc vแปฅ nhiแปt tรฌnh.  Giao hรng nhanh",5
Giao hรng nhanh vร tฦฐ vแบฅn siรชu nhiแปt tรฌnh. Chแปฏ thรชu hฦกi bรฉ xรญu nhฦฐng ฤแบนp lแบฏm nha,5
A xรฃ rแบฅt thรญch. M ฤแบทt size to quรก nรชn hฦกi rแปng. ฤag tรญnh ฤแบทt thรชm ฤรดi mรu trแบฏng nแปฏa,5
Hรng ok lแบฏm nhรฉ! Nรชn mua!!hdfhedjbbbhjitewsxvbjjjj,5
"Mรฌnh nhแบญn ฤฦฐแปฃc รกo vร ฤรฃ mแบทc r, form รกo lร form nam nรชn mรฌnh lแบฅy XS nhฦฐng mแบทc vแบซn bแป hฦกi rแปng, bรน lแบกi chแบฅt รกo ฤแบนp, giรก mแปm vร chแปฏ thรชu ฤรบng yรชu cแบงu, shop nhiแปt tรฌnh, mรฌnh thแบฅy oke lแบฏm ฤรณ แบก",5
"ฤรฃ nhแบญn ฤฦฐแปฃc รกo ๐ rแบฅt lร ฦฐng, phรน hแปฃp vแปi giรก tiแปn.
Sแบฝ tiแบฟp tแปฅc แปงng hแป",5
"รo ฤแบนp lแบฏm, form รกo khรก rแปng vร thoแบฃi mรกi. Cแบฃm ฦกn shop nhiแปu nhรฉ",5
Sแบฃn phแบฉm ฤรบng nhฦฐ nhแปฏng gรฌ shop ฤรฃ up lรชn Shopee.mแปi tแปi giao hรng hฦกi chแบญm,5
"ฤแบทt hรng รกo mรu chแป thรชu mรu vรng, shop ฤรฃ xรกc nhแบญn lแบกi rแปi mร khi nhแบญn lแบกi lร mรu ฤen. Khรดng thแบฅy shop hoรn tiแปn hay hแป trแปฃ ฤแปi trแบฃ sp mร chแป xin lแปi suรดng. ฤแป mรฌnh ฤem tแบทng nรชn rแบฅt thแบฅy vแปng.",1
Ngmxkkskdkcjkckxkfkfkkfkvkjzjskekfkvkvkv,5
