comment,rating
Mua hàng bên c đc 4 lần rồi hơn 10 cái ln mà nay e mới đánh giá nè. Hàng vnxk đẹp xuất sắc k phải hàng chợ mà giá rẻ bèo trc e mua cho Ox ngoài sh hàng này hơn 200k . Chúc chị mua may bán đắt nha ủng hộ c dài dài nè,5
"Mình có sp dầu gội thảo dược trị rụng tóc, mọc tóc, mượt tóc hiệu quả 0982762375",5
Quần chất vải đẹp.. bạn shop tư vấn rất nhiệt tình..do mình đặt mà không để ý kỹ nên đặt nhầm size. đc shop tư vấn đổi lại size..rất thích cách làm việc của shop..sẽ ủng hộ shop,5
Chất vải khá đẹp. Nhưng size 31 mà 63kg thì mặc hơi kích nên các bn mua phải cân nhắc nha nên lên size mặc cho thoải mái .,5
chất đẹp rẽ hơn so voi gia mik mua ở ngoài mang mat ck mik rat vua y,5
"Hàng đẹp, chị chủ tư vấn nhiệt tình, hỗ trợ đổi lại do k vừa luôn ạ. Đã đặt thêm luôn",5
Quần đẹp. Đường may chắn chắn. Shop tư vấn nhiệt tình. Phục vụ tốt.,5
"Quần form ok, chất vải, đường chỉ đẹp . Đã mua gần 10c quần ở shop. Rất thích cách làm việc tư vấn và xử lý khi sp bị lỗi của sh. Sẽ giới thiệu cho bb biết tới sh",5
1 quần vải đẹp. 1 quần vải k dk đẹp. Mà tag có vẻ cũ shop nhỉ. Ship nhanh.,5
"Quá đẹp , vải mềm ưng quá",5
"Mua 3 cái!
Giao đúng size đúg mẫu.
3 quần mà 2 chất liệu khác nhau!
Cái thì rõ đẹp chắc chắn kaki mềm, 2 cái kia thì bằng vẢi nhìn cũg tạm. 
Giao nhanh!",5
"Hàng đẹp, shop tư vấn nhiệt tình. Cám ơn shop.",5
"Đã mua lân 2 roi ah,rất hài lòng",5
"quần rẻ, đẹp, có đìu màu hơi khác xíu ,nhưng không sao",5
Vải đẹp. Chủ shop nhiệt tình. Sẽ tiếp tục ủng hộ,5
"Giao hàng nhanh , vải đẹp và thích nhất là đc tư vấn rất nhiệt tình . Thanks shop! Sẻ ủng hộ lâu dài!!!",5
Tư vấn nhiệt tình,5
Chất lượng OK giao hàng nhanh lắm tks shop nhiều ndndndndnxnnd,5
"Quần đẹp, vãi tốt, shop nhiệt tình mọi người yên tâm mua nhé",5
