comment,rating
"Mรฌnh so di vรฌ khรดng cรณ แบฃnh vร vid nhฦฐng mร CรC BแบN NรN MUAAAAA ๐ฅฐ๐ฅฐ

ฤแบนp, chแบฅt lฦฐแปฃng, giao chแบญm. Tuy lร pha ke nhฦฐng 300 nรชn chแบฅt lฦฐแปฃng ko tแปi ฤรขu, dรy dแบทn vรด cรนng, khoรก xแปn",5
"khoแบฃng 10 thรฌ ฤc balo, giแปng hรฌnh nhฦฐng รญt ngฤn vร mรนi hฦกi ghรช, mk phแบฃi giแบทt nhiแปu lแบงn ms hแบฟt",5
"balo rแบฅt ฤแบนp แบก, tuy lร phแบงn dฦฐแปi ฤรกy khรดng cรณ miแบฟng lรณt. hi vแปng chแบฅt lฦฐแปฃng cรณ thแป dรนng ฤฦฐแปฃc vแป lรขu dรi.",5
"Nรณi chung lร แปn, cรฒn vแป sau nhฦฐ nรo thรฌ chฦฐa biแบฟt. Bแป vรกn ฤฦฐแปฃc nha 9/10 so vแปi giรก xiแปn",5
Tuyแปt,5
Balo ฤแบนp lแบฏm แบก,5
