comment,rating
"Săn đc flasale 9k 3 đôi thì mình cũng ko có gì để chê
Tất đi khá ổn, giao hàng nhanh, shop gói hàng cũng kĩ nữa",5
"Tất khá đẹp, dai. Mua giá sale hợp lý. Sz to phù hợp vs nam giới shop ship hàng nhanh đóng gpis cẩn thận",5
"Đóng gói sp cần thận
Hàng tốt
Đóng gói sp cần thận
Hàng tốt
Đóng gói sp cần thận
Hàng tốt",5
"Giao hàng nhanh, đủ số lượng

        Set 3 đôi tất ngắn cổ MK CLEVER chất cotton khử mùi",5
"Sản phẩm đúng mẫu mã kiểu dáng, mẫu mã, đóng hàng và giao hàng cẩn thận nhanh chóng",5
jdjđjjdjdjdjdjdjdjdjdjdjdhdhdhdbdbdbdndndndbđbdbndbdbdbdbdbđbbdbdbdbdbdbdbdbdbdbd,5
"Tất đẹp lắm, dày dặn, zai gái đều đi được.... Hình ảnh mang tính chất kiếm xu",5
"Chất lượng sản phẩm tuyệt vời, shop giao hàng cho bên vận chuyển rất nhanh",5
"Tất đẹp lại mua được giá sale nữa nên càng ok,ủng hộ shop,lần sau lại mua",5
chất lượng tạm ổn trong tầm giá và khá okie để sử dụng được nên tham khảo,5
"Giao hàng nhanh, đóng gói cẩn thận, shop giao hàng giống như hình mô tả.",5
Tất thích hợp đi mùa hè nha. Shop ship hàng cũng nhanh. Many thanks ^^,5
"Giao hàng nhanh 
Đóng gói chắc chắn 
Shop rất lịch sự 
Cảm ơn shop",5
"Giao hàng đúng, đủ, chất lượng phù hợp với giá xiền :)))))))))",5
"Giao hàng nhanh chóng, sản phẩm chất lượng tốt, giá cả phù hợp",5
N m m k kbkbkbjvkcjcjvjvjgigigigugigivivuguvivugucjvjvjvjjvvj,5
"Có 9k mà đc set tất khá sịn sò, shop chuẩn bị giao hàng siêu nhanh..",5
Chất lượng sp tuyệt vời. Đóng gói sản phẩm đẹp và chắc chắn. Thời gian giao hàng ổn. Vừa số tiền mua,4
"Giao siêu nhanh, siêu sale chất lượng tạm ổnnnnnnnnnnnnnnnnn",5
Lkokokokokoko okokokoko okokokokomokkk kaomkkkkkkkk okkkok,5
"Sản phẩm chất lượng ổn định, giá rẻ quá trời, săn sale được khá lời. Gói hàng ổn định, chắc chắn.",5
"Tất có vẻ to dùng cho nam  hợp hơn, giao hàng nhanh đongs gói cẩn thận",5
"Shop bọc hàng cẩn thận
Săn sale được 4 đôi tất chất lượng
Thanks shop!",5
"Ổn áp , đi mát chân , giá cả hợp lí ,giao hàng nhanh 
Lần sau sale mua tiếp hihi",5
Dbbdnsnsndbdndmdmdndndmdkdkdjednndjsksskskskdkndndkdkddjdjdjjrnrjdjddjnrnrnrbrnr,5
Hàng ok lắm gia nhanh ................. Nói chung là ổn áp các bác ạ,5
Chất lượng tất ok mang rút mồ hôi!! Vải co giãn tốt mang giày thoáng mát không bị níu chân,5
Sản phẩm ok so với giá tiền. Mua sale nên được rẻ. Chưa đi thử nên chưa biết sao,5
Ok . Sản phẩm quá ổn,5
"Shop giao hàng k nhanh k chậm. Về sp thì cảm quan tiền nào của nấy các bác nhé :). Tất mỏng, vải hơi xù nhé. Shop đc cái inbox trả lời nhanh!",4
"Hàng đẹp, shop nhiệt tình, chuẩn vị nhanh, gói hàng đẹp. Đã mua lần n.
Thanks,",5
Sp rết ok nhanh okokokokokoklklkllkkkkkkkkkkkkkkkkkkkkkkkkkkkk,5
"Tất ổn, giao hàng nhanh, hàng giống hình ảnh đăng bán trên page.",5
"Sản phẩmm chất lượngggg, đi rất thoải máiii ..................,.,",5
"Sản phẩm giống hình, chất lượng ổn so với giá tiền
Giao hàng nhanh",5
Sản phẩm đẹp giá thành ổn đi rất thông thoáng và tốt nó lại săn đã sale giá hời lắm,5
10000000000000000000 giá ôk 0000000000000000000000,5
Ok tốt. Video để lấy xu,5
"Mặc mát vải êm phù hợp túi tiền, Hàng đẹp mà đóng gói sơ xài quá, shop rút kinh nghiệm cho lần sau nhé bớt 1 *",5
"Shop giao hàng khá nhanhhhh
Giao đúng combo
Chất tất mỏng khá mát
Có keo chống tuột sau gót",5
Tốt,5
Ko có gì để chê hết.,5
Dày dặn,5
Cảm ơn shop nhé,5
"Hàng đúng như quảng cáo
Hài lòng với sản phẩm
Sẽ tiếp tục ủng hộ",5
Vì mua flash sale nên cực kì rẻ. Tuyệt vời. Đáng để mua mà không phí tiền,5
Okela,5
"Săn sale nên chất lượng như này là ok lứm mm ạ, sẽ ủng hộ shop dài lâu",5
Tốt,5
Tất hơi nhỏ.,5
