comment,rating
Chất lượng sản phẩm tuyệt vời sẽ ủng hộ shop dài dài,5
M hơi nhỏ so với thể trạng 57kg. Chất liệu tốt,4
Chất lượng OK,5
"Vải đẹp, chưa mặc thử. Cho 5 sao.",5
"Hang tot, shop Tu van nhiet tinh, se ung ho shop lau dai",5
Vừa bụng,5
Sản phẩm chất lượng.shop tu van nhiet tinh.cho shop 5 sao.se ung ho tiep,5
"Mua 2loai, nhung lai ung loai re hon, k hiu sao loai re hon lai miem minh mat me ba co luon, con loan 90k thi vai day k thich lm",5
"Giao hàng nhanh, gói hàng tốt, chất vãi mềm tốt. Nhưng không biết quần có lỗi size không mà XXL nhỏ quá mặc chật.",5
"Cách làm việc chuyên nghiệp, giao hàng nhanh, sẽ ủng hộ, có điều có ghi chú là che tên sản phẩm nhưng không che.",5
Ok,5
Rất đẹp và hài lòng,5
Tuyệt vời,5
Quần  rất  đẹp  và  rất  OK,5
Quần đẹp. Vừa y. Sẽ ủng hộ shop Tiếp,5
"Hàng đóng gói đẹp, giao hàng tuy hơi chậm nhưng chất lượng sp rất ok. Sẽ ủng hộ shop tiếp.",5
"Quần đẹp vãi đẹp,shop nhớ bổ sung và cập nhật màu sắc rỏ ràng nhé",5
"Màu sắc không như hình dăng trong shop
Chất lượng tương đối",3
"Kêu che tên mà shop ko che, sp ok, chưa mặc nhưng sờ thấy vải ok",5
Hàng rất là OK .như hình .anh Em nên mua,5
