comment,rating
Giao hàng nhanh. Quần jean dày mà đẹp. Chất lượng ok. Nên mua nha,5
Rẻ nên không đòi hỏi nhiều chất lượng khá tốt shop tư vấn nhiệt tình,5
"Chất lượng sản phẩm tuyệt vời giao hàng nhanh,đóng gói đẹp.....",5
"Shop tư vấn nhiệt tình, sp mềm còn đẹp nữa, lần s sẽ ủng hộ shop tiếp,  cho shop ngàn tim❤❤❤❤❤❤❤❤❤❤❤❤❤❤❤❤❤❤",5
Hinh anh mang tinh chat lay xu hai long ve cgatv luong san pham,4
"Quần phù hợp với giá, nhưng mà đáy quần hơi thấp 1 chút. Giao hàng nhanh",4
Quần vải đẹp vừa luôn á,5
Đống nút hơi dở,4
"Shop phục vụ tốt đóng gói cẩn thận, quần jean hơi mỏng phù hợp với giá tiền",5
Sản phẩm đúng vải ok vừa tui tiền Noi chug ổn với tầm giá,5
"Mình đã nhận được hàng, màu sắc chuẩn so với hình, chất lượng vải tốt, giá rẻ, ngoài ra shop còn tặng kèm một chiếc khẩu trang, mình đã giới thiệu cho các bạn đồng nghiệp mua. Cảm ơn shop! Chúc shop kinh doanh phát đạt !!!",5
gv hhbjsfdjdhdvjkdjfdkfjdkljdskljfsfkdskkjfdkfjdkfjdkfjdkfjjjjjjskkdsklsldldfkfjfjriut4t9eokerlfdkkkkkkfffffffffffffffffffffffffffffffffffffffffffffffffffffffffffffffffffffffffffffffffffffffffffffffffffffffffffffffffffffffffffffffffffffffffffffffffffffffffffffffffffffffffffffffffffffffffffffffffffff,5
"Quần vải mềm mịn, ok shop nhé. Shop nhiệt tình đổi size tư vấn tốt. Giao hàng nhanh! Cảm ơn nhiều nhé !",5
"Mình đã nhận được hàng rồi nhé. Mình mua tổng cộng 13 cái quần. Giá tiền mềm mại, vừa phải. Chất vải ok. Nói chung là mình hài lòng. Ủng hộ shop nhé",5
"Giá rả so với quần nha, màu quần thì hơi đậm hơn so với hình nhưng vải rất oke nha đáng để mua. Sẽ ủng hộ shop tiếp",5
"Sản phẩm giống như mô tả giao hàng nhanh đóng gói kỹ, sp mềm  mình ưng, chưa  biết  có  bền  ko.",5
"Quần ôk, nhưng hơi chật bụng tý, giao hàng khá ổn, chấp nhận giá tiền, nhưng mong shop cải tiến hơn",5
"Đánh dấu mua hàng lần sau
.chat liomg sp tot. Giao hang cuc nhanh. Pv tot",5
"Shop gói cẩn thận, gửi hàng kèm bức tâm thư hài quá, đã mua lần hai, rất hài lòng về shop và sản phẩm, sẽ ủng hộ shop nữa",5
"Hàng không đúng như quảng cáo, mã hàng khác, chất vải thì bị xù, thật k tin đc, sẽ khó để tin tưởng mua quần áo qua shop nữa",5
"mình đã nhận được hàng, rất ưng ý với chất lượng sản phẩm. cảm ơn shop !",5
"mình đã nhận được hàng, rất ưng ý với chất lượng sản phẩm. cảm ơn shop !",5
"hàng đẹp, giao hàng nhanh, đúng mẫu đúng size đã chọn. Mọi ng nên mua",5
"tôi 75kg, size 36 mặc vừa vặn. Shop giao đúng màu, đúng số lượng, ống quần dài hơn, rất OK. mua lần này là lần 2.",5
Hàng ok chất lượng phù hợp giá tiền cho shop 5sao nha se tiếp tục ủng hộ,5
"Quần màu nhạt ớt ngoài ít đẹp hơn màu đậm, 2 quần đều mặc vừa, giá rẻ.",5
"chât lượng hàng tôt hơn gia tiền, rất ok, còn đc tặng thêm 2 cái khâu trang vải, lần sau có dịp se ủng hộ shop tiêp",5
"Quần rất đẹp ,mềm ,dáng quần đẹp, còn tặng quà, cảm ơn shop♥️♥️♥️♥️♥️♥️♥️",5
shop giao thiếu hàng mà giải quyết chậm....3 sao thôi.,3
Tam duoc,5
"Chất lượng sản phẩm tốt
 Giá rẻ còn được tặng thêm quà nữa 
Sẽ ủng hộ Shop dài dài ❤️",5
"Chất lượng ổn, còn nhận được quà từ shop nữa, xin cảm ơn.",5
Rất tốt,5
"Shop cần chú ý khi giao hàng, mặt sau bị nổ chỉ một số chỗ. Đóng gói cẩn thận.",5
Trưa mặc đã mọc lông hàng vớ vẩn,5
Quần giặt ra màu,5
Quần rất đẹ,5
chât lượng sản phẩm phù hợp với gía tiên,3
