comment,rating
"[QC] DUNG VIETTELPAY, DAT NGAY VIETLOTT. Chi tu 10.300d dat ve Vietlott va thanh toan qua ViettelPay ngay hom nay de co co hoi trung cac giai thuong hap dan ban nhe. Truy cap https://viettelpay.onelink.me/2dRm/vietlotts4 de dat ve ngay. Chi tiet LH 18009000 (0d). Tu choi QC, soan TC3 gui 199.",5
Vbnkhgffgjjkkhgresxfghjknbbvffyyjj. ฤฦฐแปฃc. Hhggghujjjhfxccvhhjjkjjhgffffvbhuytrfghjjkjjnh. ฤแบฅy,5
Chแบฅt lฦฐแปฃng tแบกm แปn vแปi mแปฉc giรก,5
Hรng ฤแบนp giao hรng nhanh phรน hแปฃp vแปi giรก tiแปn sแบฝ tiแบฟp tแปฅc แปงng hแป shop,5
Hรng ฤรณng gรณi cแบฉn thแบญn mแปi tแปi giao hรng hฦกi lรขu mแปt xรญu chแบฅt lฦฐแปฃng tแปt balo ฤแปฑng ฤฦฐแปฃc cแบฃ latop 15.6 in,5
"Nhแป shop ghi thiแปp chรบc mแปซng sn anh
Mร shop ghi thiแปp mแปซng sn ny๐๐
Dรน sao cลฉng cแบฃm ฦกn shop nhiแปu nhiแปu
ฦฏng thรกi ฤแป lvc cแปงa shop
Balo ฤแบนp, chแบฅt lฦฐแปฃng hแปฃp giรก tiแปn nha mnโคโค",5
balo ฤแบนp lแบฏm nhaaaaaaaaaaaaaaaaaaaaaaaaaaaaaaaaaaaaaaaa,5
"Hรng giแปng mรด tแบฃ nhฦฐng bรฉ hฦกn nhiแปu so vแปi mรด tแบฃ chiแปu dรi chแป khoแบฃng 43 cm khรดng ฤแปฑng vแปซa laptop 15,6in ฤรฃ nhแบญn ฤฦฐแปฃc hรng, ฤรณng gรณi ฤแบนp vร chแบฏc chแบฏn. Giao hรng nhanh chรณng",5
Whdidjdbdhwuiwjsbdhxusoanwbdjduenrhdhidsjnehdhfudiebdbxjsisk,5
https://www.facebook.com/thptnguyentruongtovinh/photos/a.574053402744444/1775347565948349/?type=3,5
Hahsjdjdjdjskqkqbsbdbxbdjdkdkdmfkfkdnsbsbsjsbsbshxjfjekwoendnxjfidjdndndbdjdndjxjxjxbsvwgwjsbxjdkcjcjcncncncnckdjdjdbwvฦฐvqhsisjsbdnxkcodksb,5
"Giao hรng lรขu hฦกn lแบงn trฦฐแปc, sแบฃn phแบฉm lแบงn nรy khรดng nhฦฐ hรฌnh แบฃnh, balo laptop mแปng",4
"Giao hรng nhanh, shop gรณi hรng tแปt. Balo nhแป hฦกn tฦฐแปng tฦฐแปฃng mแปt xรญu, nhฦฐng khรก oke, ฤฦฐแปฃc tแบทng dรขy usb kแบฟt nแปi vแปi ฤแบงu sแบกc. Tiแบฟc lร khรดng chแปng nฦฐแปc =)) nhฦฐng giรก rแบป nรชn khรดng ฤรฒi hแปi nhiแปu. Hรng chแบฅt lฦฐแปฃng tแปt so vแปi giรก tiแปn",5
Ba lรด ฤแบนp.  Tuy hฦกi mแปng ฤแปi vแปi hแปc sinh cแบฅp 2 dรนng ฤi hแปc nhฦฐng mรฌnh vแบซn vote cho shop,5
"Hรng nhฦฐ hรฌnh, chแบฅt lฦฐแปฃng ok. Ship hรng nhanh, shipper thรขn thiแปn okkkkkkkkk",5
"Chแบฅt lฦฐแปฃng tแปt, ฤแบนp, hรng nhฦฐ trong แบฃnh, mรฌnh rแบฅt thichd sp nรy!",5
"Sแบฃn phแบฉm chแบฅt lฦฐแปฃng, rแบฅt hรi lรฒng. Lแบงn sau sแบฝ แปงng hแป shop. Hรฌnh แบฃnh vร video chแป mang tรญnh chแบฅt nhแบญn su hihi. Vรฌ em gรกi nhแบญn nรชn chฦฐa chแปฅp ฤc",5
"ฤรฃ nhแบญn ฤฦฐแปฃc hรng.hรng ฤแบนp.ฤรณng gรณi cแบฉn thแบญn, giao hรng nhanh.cแบฃm ฦกn shop",5
hรng ฤjep vร dแบฅyc hแบฅt lแบนwksjbairwtowtoswrairqtiwtiwyoeoyeoysotsgkx puoyaoyeyotkatkagkKzitsds,5
"Balo hแปฃp vแปi giรก tiแปn, lรบc ฤแบทt tฦฐแปng nhแป nhฦฐng khi vแป thแบฅy khรก lแปn",5
"Balo ฤแบนp lแบฏm nhaaaaa. Chแปง shop rep ib dแป thฦฐฦกng lแบฏm รก, do em cแบงn gแบฅp quแบงn nรชn chแปง shop ฤรฃ giรบp em liรชn hแป vแปi bรชn vแบญn chuyแปn ฤแป ฤแบฉy ฤฦกn kแปp cho em ฤi chฦกi nรจ. Khรดng mua lร cแปฑc kรฌ phรญ nha cacbannn iuuuu shoppp 3000 โค๏ธโค๏ธโค๏ธ. Em sแบฝ tiแบฟp tแปฅc แปงng hแป shop dรi dรi แบก",5
Giao thiแบฟu. Trong mรด tแบฃ cรณ nรณi sแบฝ ฤc tแบทng tai nghe nhฦฐng ko thแบฅy mua cแบทp vแป thรฌ vแปซa cแบงm cรกi quai ฤรฃ ฤแปฉt. Thแบฅy thแบฅt vแปng vแป sp nhฦฐng shop ฤรฃ ns sแบฝ ฤแปi trแบฃ cho mk sp ms ฤรบng nhฦฐ mรด tแบฃ. Phแปฅc vแปฅ rแบฅt tแปt.,5
"Balo dรy dแบทn. ฤแปฑng ฤc laptop, giแบฅy a4 thoแบฃi mรกi. Giรก thรnh rแบป so vแปi bรชn ngoรi. Nรณi chung lร rแบฅt ok ๐๐๐๐๐๐",5
"Lแบงn trฦฐแปc mua cรกi รกo thun thแบฅy khรก แปn, lแบงn nรy mua thรชm balo xem nhฦฐ nรo thรฌ ฤรบng lร vแบซn k hแป thแบฅt vแปng. Chแบฅt vรi dรy dแบทn, mรu ฤen ghi nhฦฐ mแบซu trรชn แบฃnh. Tiแบฟp tแปฅc mua hรng cแปงa shopppp",5
"Quแบงn phแบฃi nรณi lร ""SANG, XแปN, MแปN"" ๐๐๐ ๐๐๐ Chแบฅt jean dรy dแบทn, mรu xanh nhแบกt ฤแบนp nhฦฐ hรฌnh. Cรณ 10* cho Shop 10* luรดn! ๐คฃ๐คฃ๐คฃ Lแบงn nรo mua  cแปงa Shop cลฉng ฦฐng รฝ hแบฟt รฝ! ๐๐๐ Shop phแปฅc vแปฅ rแบฅt nhiแปt tรฌnh vร thรขn thiแปn! Admin thรฌ rep inbox rแบฅt nhanh! Yรชu Shop quรก ฤi! โฅ๏ธโฅ๏ธโฅ๏ธ",5
"ฤรฃ nhแบญn ฤฦฐแปฃc sแบฃn phแบฉm, mแบซu mรฃ giแปng vแปi mรด tแบฃ, nhฦฐng mรฌnh cแปฉ nghฤฉ nรณ to hฦกn.shop ฤรณng gรณi nhanh.แปงng hแป shop๐๐๐",5
"ฤang dแปch mร giao vแป tแปnh rแบฅt nhanh, mรu ฤแบนp nhฦฐ hรฌnh, cรฒn khuyแบฟn mแบกi tai nghe. Rแบฅt thรญch",5
"Balo dรy dแบทn, ฤแปฑng ฤฦฐแปฃc rรขtz nhiแปu ฤแป. Khรก ฦฐng, giao hรng nhanh, gรณi cแบฉn thแบญn. Sแบฝ tham khแบฃo thรชm nhiแปu sแบฃn phแบฉm nแปฏa.",5
"Sแบฃn phแบฉm y hรฌnh. Balo to ฤแบนp , ngฤn lแปn ฤแปฑng ฤฦฐแปฃc rแบฅt nhiแปu ฤแป., bรชn trong cรณ nhแปฏng ngฤn nhแป ฤแปฑng ฤแป tiแปn.",5
Sแบฃn phแบฉm khรก แปn vแปi tรบi tiแปn. Tรบi chแปng sแปc dรy dแบทn ฤแปฑng laptop ok. Ngoรi ra cลฉng ฤแปฑng thรชm ฤฦฐแปฃc khรก nhiแปu ฤแป.,5
"Shop giao hรng nhanh, mรฌnh ko cรณ nhร nรชn nhแป ng nhแบญn hแป, vแป nhร mรฌnh test chแบฅt lฦฐแปฃng luรดn r bh phแบฃn hแปi cho shop ฤรขy, sแบฃn phแบฉm rแบฅt OK nhรฉ, vแบฃi mแปn ko bแป bรดng xรน, ฤฦฐแปng chแป ฤแปu, nรณi chung rแบฅt hรi lรฒng",5
"Chแบฅt lฦฐแปฃng sแบฃn phแบฉm tแปt, ฤรณng gรณi cแบฉn thแบญn vร chแบฏc chแบฏn, giao hรng nhanh, phแปฅc vแปฅ tแปt, rแบฅt hรi lรฒng, sแบฝ แปงng hแป thรชm, tแบทng shop 5*",5
"Sแบฃn phแบฉm chแบฅt lฦฐแปฃng tแปt, giao hรng nhanh, ฤรณng gรณi sแบฃn phแบฉm kแปน, ngฤn rแปng rรฃi ฤแปฑng ฤแป thoแบฃi mรกi.",5
"Chแบฅt lฦฐแปฃng sแบฃn phแบฉm ok. Nhรฌn chแบฏc chแบฏ , ฤฦฐแปng may ฤแบนp ฤแปu, ฤแปฑng ฤฦฐแปฃc nhiแปu ฤแป. Vแปซa lap 15.6inch.",5
"Balo dรy dแบทn vร rแบฅt รชm, vแปซa ฤแปฑng ฤฦฐแปฃc laptop lแบกi thรชm rแบฅt nhiแปu sรกch vแป ฤแป dรนng nแปฏa. Nรณi chung khรก ฦฐng.",5
Mua ฤen cแปฉ giao xรกm. Bแปฑc cแบฃ mรฌnh,1
"Giao hรng nhanh, hรng ฤฦฐแปฃc gรณi cแบฉn thแบญn, shop tฦฐ vแบฅn nhiแปt tรฌnh, giแปng แบฃnh. Khรก hรi lรฒng. Vote 5 sao.",5
"Sแบฃn phแบฉm chแบฅt liแปu tแปt, giao hรng nhanh, ฤรณng gรณi sแบฃn phแบฉm kฤฉ, ngฤn rแปng ฤแปฑng ฤแป thoแบฃi mรกi.",5
"Balo ฤแบนp y hรฌnh, ngฤn rแปng ฤแปฑng ฤฦฐแปฃc nhiแปu ฤแป, shop ฤรณng gรณi cแบฉn thแบญn nรชn yรชn tรขm. Vote 5 sao",5
"Balo chแบฏc chแบฏn, dรy dแบทn, cรณ ngฤn ฤแปฑng laptop รชm, bแบฃo vแป tแปt. ฤแปฑng ฤฦฐแปฃc khรก nhiแปu ฤแป. Rแบฅt ฦฐng.",5
"Balo ฤแบนp. Vแบฃi ฤแบนp. Giao hรng nhanh.
ฤรณng gรณi cแบฉn thแบญn 
:))))))))",5
"Bao tแบกm แปn . Khรดng cแปฉng cรกp lแบฏm  nhฦฐng vแปi giรก thรnh ฤรณ thรฌ hแปฃp lรญ, sแบฝ cรฒn แปงng hแป shop ๐๐ป๐๐ป๐๐ป๐๐ป๐๐ป๐๐ป๐๐ป๐๐ป๐๐ป๐๐ป๐๐ป๐๐ป๐๐ป๐๐ป๐๐ป๐๐ป๐๐ป๐๐ป๐๐ป๐๐ป๐๐ป๐๐ป๐๐ป๐๐ป๐๐ป",5
"Rแบฅt ฤแบนp luรดn nha, ฤแปฑng ฤฦฐแปฃc nhiแปu ฤแป, cรณ ngฤn ฤแปฑng laptop rแบฅt รชm, bแบฃo vแป tแปt. Vote 5 sao.",5
May chแบฏc chแบฏn nhฦฐng mร khรดng dรนng vแปซa lap 15.6 inch.........,5
"Hรng giao nhanh, y nhฦฐ hรฌnh, chแบฅt lฦฐแปฃng ok trong tแบงm giรก, mแปi ngฦฐแปi mua dรนng cลฉng hแปฃp lรฝ ฤแบฅy",5
"Sแบฃn phแบฉm chแบฅt lฦฐแปฃng tแปt, phรน hแปฃp vแปi giรก tiแปn, ฤแปฑng lap 15.6inch thoแบฃi mรกi luรดn nha.",5
"Balo vแบฃi dรy , ฤแบนp, may chแบฏc chแบฏn ฤรบng nhฦฐ shop mรด tแบฃ,, ฤแปฑng khรก nhiแปu ฤแป, vote 5 sao.",5
"Shop phแปฅc vแปฅ vแปฑc chu ฤรกo, giao hรng nhah. Balo siรชu xแปn luรดn, nรณi chung lร ฦฐng .",5
"Balo vแบฃi ฤenp dรy ฤฦฐแปng may chแบฏc chแบฏn ฤรบng nhฦฐ mรด tแบฃ, thแปi gian giao hรng nhanh",5
"Balo ฤแบนp , giรก hแปฃp lรญ tแปt hฦกn mong ฤแปฃi",5
"Giao hรng nhanh, gรณi hรng cแบฉn thแบญn, mรฌnh thแบฅy khรก rแปng, ฤแปฑng laptop vร ฤแป thoแบฃi mรกi.",5
Sp ok . Cรณ ฤiแปu cรกi quai tรดi nghฤฉ nแบฟu xรกch tay thรฌ nรณ sแบฝ khรณ vรฌ thแบฟt kแบฟ ko ฤรบng tรขm cแปงa balo. ฤeo thรฌ ok . ฤแบนp,5
Sแบฃn phแบฉm ฤแบนp . nhฦฐng kรญch thฦฐแปc khรดng ฤรบng nhฦฐ mรด tแบฃ . cao cรณ 40 cm mร nรณi 47 . khรดng hรi lรฒng chรบt nรo yรชu cแบงu ngฦฐแปi bรกn ghi ฤรบng kรญch thฦฐแปc,5
"ฤรฃ nhแบญn ฤฦฐแปฃc vร rแบฅt ฦฐng chแบฅt lฦฐแปฃng, shop tฦฐ vแบฅn nhiแปt tรฌnh, hรng chuแบฉn form, y แบฃnh. Sแบฝ แปงng hแป shop dรi dรi.",5
"Balo ฤแบนp, dรy dแบทn, chแบฏc chแบฏn. Giแปng y hรฌnh. ฤฦฐแปng chแป khรขu ฤแบนp chแบฏc chแบฏn.",5
"Lแบงn thแปฉ 2 mua hรng cแปงa shop, lแบงn trc mua quแบงn thแบฅy oke, mua thรชm balo ฤแป ฤi hแปc, chแบฅt vแบฃi แปn, mแปm tay",5
"Cแบฃm ฦกn shop nhรฉ. Shop trแบฃ lแปi tฦฐ vแบฅn rรต rรng. ฤแป mรฌnh nhแบญn vแปซa vแบทn vร ฤแบนp lแบฏm, mรฌnh rata hรi lรฒng",5
"Lแบงn thแปฉ N mua hรng nhร shop, k cรณ gรฌ phแบฃi phรn nรn cแบฃ, sp tแปt tฦฐ vแบฅn tแปt giao hรng nhanh, hรดm trc ฤแบทt hรดm sau cรณ luรดn. 10 ฤiแปm.",5
"Tฦฐ vแบฅn nhiแปt tรฌnh. Giao hรng nhanh, ฤรฃ nhแบญn vร rแบฅt ฦฐng. Hรi lรฒng, vote 5 sao.",5
"ฤรฃ nhแบญn ฤฦฐแปฃc hรng, giao nhanh, hรng chuแบฉn hรฌnh, rแบฅt ฦฐng. Sแบฝ giแปi thiแปu cho bแบกn bรจ.",5
"Balo form cแปฉng cรกp, ngฤn rแปng ฤแปฑng ฤฦฐแปฃc khรก nhiแปu ฤแป, cรณ ngฤn ฤแปฑng laptop dรy dแบทn, ฤฦฐแปng may chแบฏc chแบฏn, rแปng rรฃi thoแบฃi mรกi.",5
"Giao hรng nhanh, ฤรฃ nhแบญn ฤฦฐแปฃc hรng vร rแบฅt ฦฐng. Balo dรy ฤแบนp. Vote 5 sao.",5
"ฤรฃ nhแบญn ฤฦฐแปฃc hรng. Sแบฃn phแบฉm giแปng hรฌnh, mรฌnh rแบฅt ฦฐng, sแบฝ แปงng hแป shop lรขu dรi",5
"Balo quรก ฤแบนp, vแบฃi chแบฏc chแบฏn, ฤฦฐแปng kim mลฉi chแป chuyรชn nghiแปp, nhรฌn lร thแบฅy mรช rแปi heheeh",5
"Shop giao hรng nhanh chรณng, cรณ tรขm lแบฏm, tฦฐ vแบฅn size chuแบฉn vch, cแบฃm ฦกn shop nhiแปu nhรฉ ๐",5
"Giao hรng nhanh, ฤรณng gรณi cแบฉn thแบญn, chแบฅt lฦฐแปฃng sแบฃn phแบฃm thรฌ chฦฐa biแบฟt tnao, dรนng 1 tgian sแบฝ cho phแบฃn hแปi, mแปi ฤแบงu nhรฌn thรฌ cรณ vแบป khรก chแบฏc chแบฏn vร ฤแบนp",5
"Balo laptop dรy dแบทn, nhรฌn ฤฦกn giแบฃn phรน hแปฃp vแปi mรฌnh, ฤแป bแปn thรฌ phแบฃi dรนng mแปi ฤรกnh giรก tiแบฟp ฤc",5
"Mua lแบงn thแปฉ 2 cแปงa shop rแปi rแบฅt yรชn tรขm vแป chแบฅt lฦฐแปฃng sแบฃn phแบฉm, giao hรng nhanh",5
"Hรng siรชu xแปn luรดn รก mn, giรก rแบป hรng cรฒn chแบฅt lฦฐแปฃng hฦกn nแปฏa nรชn แปงng hแป Shop ฤi nรจ. Tl tin nhแบฏn cลฉng dแป thฦฐฦกng nแปฏa. Giao hรng nhanh vร ฤแบนp cแปฑc รญ",5
"Shop tฦฐ vแบฅn nhiแปt tรฌnh, gรณi hรng cแบฉn thแบญn nรชn rแบฅt yรชn tรขm khi nhแบญn ฤฦฐแปฃc hรng, chuแบฉn แบฃnh vร mรด tแบฃ. Vote 5 sao",5
"Hรng ฤรบng nhฦฐ mแบซu,ฤรฃ dรนng thแปญ rแบฅt OK rแบฅt hรi lรฒng, gรณi hรng cแบฉn thแบญn,cho shop 5 Sao vร sแบฝ แปงng hแป tiแบฟp, giao hรng nhanh, shop thรขn thiแปn, ๐",5
"ฤรฃ nhแบญn dc hรng. Gia hรng nhanh ฤรบng mแบซu. Balo chแบฏc chแบฏn, nhแบน. Giรก rแบป rแบฅt tแปt. Hรng hแปn :))) ๐๐๐",5
Hรng ok แบก. Rแบฅt thรญch. Hฦกi nhแป chแบฏc tแบกi lap e to. Vแบซn vแปซa รก. Cรณ lแปp dรy hai bรชn bแบฃo quแบฃn mรกy.,5
"Shop tฦฐ vแบฅn nhiแปt tรฌnh, hรng chuแบฉn แบฃnh, size vแปซa ngฦฐแปi, chแบฅt khรก mแปn vร mรกt , mแบทc แปk lแบฏm. Rแบฅt ฦฐng",5
"Giao hรng rแบฅt nhanh, chแบฅt lฦฐแปฃng sแบฃn phแบฉm hแปฃp giรก tiแปn. Shop tฦฐ vแบฅn nhiแปt tรฌnh. Sแบฝ tham khแบฃo thรชm nhiแปu sแบฃn phแบฉm.",5
"Sแบฃn phแบฉm giแปng nhฦฐ trรชn แบฃnh, tรดi rแบฅt hรi lรฒng vแป sแบฃn phแบฉm. Sแบฝ แปงng hแป dรi dรi.",5
"Vแบฃi mแปn, khรดng nhฤn vร khรดng cรณ lแปi gรฌ cแบฃ. Shop nรณi chuyแปn rแบฅt dแป thฦฐฦกng, hรng giao lแบกi cแปฑc nhanh, ฤแบทt 1 ngรy lร tแปi rแปi ^^ rแบป nhฦฐng chแบฅt lฦฐแปฃng khรดng ngแป ฤรณ nha.",5
"Chแบฅt dรy dแบทn, Giรก hแปc sinh mร chแบฅt lฦฐแปฃng tแปt ghรช, vote 5 sao chแบทt.",5
Chแบฅt lฦฐแปฃng sแบฃn phแบฉm ฤแบนp ฤรณng gรณi chแบฏc chแบฏn shop phแปฅc vแปฅ tแปt giao hรng nhanh,5
"Balo khรก xinh nhรฉ,k biแบฟt dรนng bแปn hay k nhฦฐng nhรฌn thรฌ ok,hแปฃp giรก tiแปn",5
"ฤรฃ nhแบญn ฤฦฐแปฃc hรng,vแบฃi cแปฑc chแบฅt,shop tฦฐ vแบฅn nhiแปt tรฌnh,chแบฅt ฤแบนp + shop nhiแปt tรฌnh mua k ฤแบฏn ฤo nhiแปu. แปงng hแป shop 5 sao",5
"Chแบฅt lฦฐแปฃng sแบฃn phแบฉm tแปt, giao hรng lรขu, ฤรณng gรณi sแบฃn phแบฉm chแบฏc chแบฏn",5
Balo ฤแบนp shop tฦฐ vแบฅn nhiแปt tรฌnh ko uแปng cรดng mong ฤแปฃi,5
"Giao hรng nhanh, gรณi cแบฉn thแบญn. Vote 5 sao.",5
"Balo ฤแบนp kiแปu dรกng nhฦฐ hรฌnh, ฤฦฐแปng may chแบฏc chแบฏn, ฤรกng ฤแป mua nha mแปi ngฦฐแปi",5
"Mua cแปงa shop nhiแปu rแปi, chแบฅt lฦฐฦกng luรดn yรชn tรขm, 5 sao nhรฉ",5
"Lแบงn ฤรขu mua hรng trรชn shoppe khรก lo lแบฏng, may quรก chแปn ฤc shop tฦฐ vแบฅn nhiแปt tรฌnh vร bรกn hรng cรณ tรขm, nhแบญn hรng y แบฃnh, chรบc shop lรm ฤn phรกt ฤแบกt.",5
"Giao hรng nhanh, ฤรณng gรณi cแบฉn thแบญn, shop tฦฐ vแบฅn nhiแปt tรฌnh, sแบฃn phแบฉm ฤรบng แบฃnh vร mรด tแบฃ. Khรก ฦฐng.",5
"Balo ฤแบนp, giao hรng nhanh, shop tฦฐ vแบฅn nhiแปt tรฌnh",5
Phแบฃi nรณi lร quรก ฦฐng tแปซ cรกch nรณi chuyแปn cแปงa shop vร hรng cแปงa shop. So vแปi tแบงm giรก nรy thรฌ quรก lร oke luรดn รก m.nggg.,5
"Balo to nhiแปu ngฤn ฤแปฑng ฤc nhiแปu ฤแป , giao hรng nhanh",5
"Tแบงm giรก nรy ฤฦฐแปฃc balo xinh nhฦฐ vแบญy lร quรก แปn luรดn, tฦฐแปng ko ฤแบนp mร ฤแบนp ko tฦฐแปng, cแบฃm ฦกn shop nhiแปu, sแบฝ แปงng hแป dรi dรi แบก, gรณi hรng cลฉng rแบฅt cแบฉn thแบญn giao hรng cลฉng nhanh",5
"Balo ฤแบนp y nhฦฐ hรฌnh. Shop tฦฐ vแบฅn , rep แปn nhiแปt tรฌnh",5
"Sแบฃn phแบฉm ฤรบng แบฃnh vร mรด tat, tฦฐ vแบฅn nhiแปt tรฌnh, giao hรng nhanh. Rแบฅt ฦฐng. Sแบฝ tham khแบฃo thรชm.",5
"Mแบซu mรฃ y nhฦฐ hรฌnh. Chแบฅt lฦฐแปฃng tแปt, giรก rแบป. Nรณi chung quรก hแปฃp lรฝ.",5
"Balo dรy dแบทn, cรณ ngฤn ฤแปฑng laptop rแบฅt ok, rแปng rรฃi ฤแปฑng ฤฦฐแปฃc nhiแปu ฤแป",5
"Shop giao hรng nhanh, mรฌnh ko cรณ nhร nรชn nhแป ng nhแบญn hแป, vแป nhร mรฌnh test chแบฅt lฦฐแปฃng r phแบฃn hแปi cho shop sau",5
"Balo ฤแบนp, giao hรng nhanh, tฦฐ vแบฅn nhiแปt tรฌnh",5
Shop giao hรng nhanh shop tฦฐ vแบฅn nhiแปt tรฌnh,5
"Balo ฤแบนp, ฤฦฐแปng may chแบฏc chแบฏn, mua tแบทng bแบกn thแบฅy nรณ ฦฐng, thank shop",5
"Chแบฅt vแบฃi mแบทc nhแบน, dรy dแบทn, ร quรชn ฤc tแบทng cแบฃ tรบi thฦกm, mแป ra thฦกm nแปฉc mลฉi ๏ 5 sao. Chรบc shop phรกt tรi",5
"Mua ฤแป tแบทng cho thแบฑng bแบกn thรขn, Nรณ khen qtroi quรก ฤแบฅt. Giao hรng nhanh, chแบฅt lฦฐแปฃng tแปt, ฤรกng giรก tiแปn.",5
"Balo ฤep hฦกn mk tฦฐแปng , shop hรng siรชu nhanh",5
Balo chแบฏc chแบฏn to shop giao hรng nhanh,5
"Chแบฅt lฦฐแปฃng sแบฃn phแบฉm tแปt, ฤรณng gรณi ฤฦฐแปฃc. Chแบฏc chแบฏn. Nรชn mua hรng แบก",5
"ฤแบทt balo mรu ghi ฤแบญm nhฦฐng shop giao mรu ฤen, hฦกi buแปn. Balo ฤแปฑng ฤฦฐแปฃc laptop 15,6inch. Chuแบฉn bแป hรng nhanh, giรก cแบฃ hแปฃp lรญ, ฤฦฐแปฃc tแบทng kรจm tai nghe^^",5
Balo ฤแบนp rแปng ฤแปฑng ฤฦฐแปฃc khรก nhiแปu ฤแป ฤรณ,5
Lแบงn sau mรฌnh nhแบฅt ฤแปnh sแบฝ mua tiแบฟp. Nรณi chung lร rแบฅt แปn. Rแบฅt vui khi nhแบญn ฤฦฐแปฃc hรng. Thanks shop,5
"Chแบฅt lฦฐแปฃng sแบฃn phแบฉm แปn, giao hรng nhanh vร ฤรบng theo yรชu cแบงu. Sแบฝ giแปi thiแปu cho bแบกn bรจ",5
"Shop tฦฐ vแบฅn nhiแปt tรฌnh, sแบฃn phแบฉm giแปng แบฃnh vร mรด tแบฃ. Vแปซa vแปi giรก tiแปn. Khรก ฦฐng.",5
"Thแปi gian giao hรng nhanh, chแบฅt lฦฐแปฃng sแบฃn phแบฉm tแบกm แปn quai xรกch xem cรณ vแบป khรดng chแบฏc chแบฏn lแบฏm, ฤรณng gรณi cแบฉn thแบญn",4
"Sแบฃn phแบฉm ฤแบนp lแบฏm ฤรบng nhฦฐ quแบฃng cรกo. Shop bรกn hรng nhiแปt tรฌnh, chฤm sรณc khรกch hรng tแปt lแบฏm",5
"Chแบฅt lฦฐแปฃng sแบฃn phแบฉm tuyแปt vแปi, ฤรณng gรณi sแบฃn phแบฉm rแบฅt ฤแบนp vร chแบฏc chแบฏn",5
Balo dรy dแบทn giao hรg nhanh,5
"Mua lแบงn thแปฉ 2 rแปi ฤแป lแบงn nรo cลฉng ฤแบนp, hi vแปng cรกc lแบงn mua sau cลฉng ฤฦฐแปฃc nhฦฐ thแบฟ แบก hihi",5
"Shop tฦฐ vแบฅn nhiแปt tรฌnh, gรณi hรng cแบฉn thแบญn, rแบฅt ฦฐng nha.",5
"Giao hรng nhanh, ฤรณng gรณi cแบฉn thแบญn, shop tฦฐ vแบฅn nhiแปt tรฌnh. Rแบฅt ฦฐng.",5
Baolo ฤแบนp sแบฝ แปงng hแป lแบงn sau,5
"Balo cรณ ngฤn chแปฉa ฤแป rแปng rรฃi, ngฤn laptop riรชng, ฤฦฐแปng kim khรขu khรก chแบฏc chแบฏn. Nรณi chung mรฌnh thแบฅy hแปฃp giรก tiแปn.",5
"Sแบฃn phแบฉm tแปt, giao hรng nhanh chรณng, ฤรณng gรณi kฤฉ cรng, phแปฅc vแปฅ tแปt, ฤรกnh giรก shop 5*, MN nรชn mua แป shop nรy nha",5
"Mua cแปงa shop nhiแปu lแบงn rแปi rแบฅt yรชn tรขm vแป chแบฅt lฦฐแปฃng sแบฃn phแบฉm,  giao hรng nhanh",5
"OK lแบฏm แบก, hรng y hรฌnh",5
