comment,rating
Đa nhan hang. Shop giao hang nhanh đong goi cân thân hang phù hợp với giá,5
"Thời gian giao hàng bình thường, sản phẩm khá okie, còn chất lượng thì chờ thời gian xem sao, ủng hộ shop 5 sao nhé",5
Giao hàng nhanh chất lượng sản phẩm cũng ok la sorry vì k chụp vs quay video đc,5
"Tất đẹp dày dặn lắm ạ, shop tặng kèm cả lời chúc và bao lì xì....",5
"Chất lượng sp ok ,nên mua nha mọi người..................",5
"Đã nhận được hàng, đóng gói cẩn thận, đúng với đơn đặt. Mua lại lần thứ 2",5
Sp chất lượng phù hợp với giá tiền. Giá rẻ hơn so với mình ra ngoài cửa hàng mua,5
"Hàng của shop đẹp, chất lượng tốt. Thời gian giao hàng từ 2-3 ngày. Shipper nhiệt tình nha",5
"Tất cũng đẹp, chất lượng tốt không quá dầy dặn cũng không mỏng",5
Cảm ơn shop rất nhiều!giá rất phù hợp với sản phẩm!,5
giao hàng nhanh. đóng gói cẩn thận. giống hình. tất dày dặn..,5
"Tất mỏng, chất nhanh dãn. Mình lưu ý giao màu tối nhưng shop giao toàn màu xám, trắng có 1 đôi đen thôi.",2
"Sản phẩm chất lượng tốt, đi thoải mái",5
Hàng đẹp mọi ng nên mua của shop nhed,5
"Thời gian giao hàng nhanh, mùi quế thơm",5
"Cũng tạm được . Tất này đi khó thấm mồ hôi
Giá này cũng tạm .",4
chất lượng tốt,5
Sản phẩm rất Ok. Mua online rẻ hơn nhiều so với mua bên ngoài nhé,5
j,5
"Đủ số lượng , chip nữ k đúng kiểu",5
Tất đẹp rất hài lòng. Giá quá mềm hẹn sẽ mua lại sản phẩm này.cho 5 sao,5
Chất cũng được phù hợp giá tiền,5
Rất tuyệt,5
"Tất đẹp, dày dặn phù hợp với giá tiền, đã mua nhiều lần bà sẽ tiếp tục ủng hộ",5
Hang đẹpl đáng muaaaaaaaaaaaaaaaaaaaaaaaaaaaaaaaaaaaaaaaaaaaaaaaaaaaaaaaaaaaaaaaa,5
Vớ mỏng. Giao hàng nhanh. Vui khi thấy tờ giấy cảm ơn khách hàng của shop.,5
0Guiccy00fyy9d9t99dydd9d69yd9yd0dypdyyodfjssititstsr,5
