comment,rating
"Shop tư vấn phục vụ nhiệt tình, chất lượng áo tốt như mô tả, áo như hình, đường may cẩn thận",5
"áo đẹp , chất lượng ok hợp với giá tiền, from áo rất chuẩn mình 56kg mặc rất vừa sz L, có dịp ủng hộ shop tiếp",5
"shop tư vấn rất nhiệt tình, chất lượng áo đẹp vừa với giá tiền, lần sau ủng hộ tiếp",5
"Shop chuẩn bị hàng nhanh chóng,áo chất lượng đứng mô tả, size cũng chuẩn nhé. Sẽ tiếp tục ủng hộ shop ạ",5
"áo đúng như hình, chất lượng ok, shop tư vấn nhiệt tình mùa về mặc vừa luôn, lần sau ủng hộ shop tiếp",5
"sản phẩm rất ưng, chất đẹp không xù mình mua 2 chiếc thấy rất ổn, sẽ tiếp tục ủng hộ shop",5
"áo đã mặc và giặt 5 lần rồi mà vẫn giữ màu với from, tốt thật sự phải vào đánh giá",5
"nhà tôi 3 đời mua áo thun, chất lượng tốt thật, lần sau ủng hộ shop tiếp",5
"màu giống hình mô tả, chất vải dày dặn mặc mát, không có chỉ thừa",5
"hàng đóng gói cẩn thận, chất lượng ok, shop tư vấn nhiệt tình",5
"áo mặc hơi chật liên hệ shop, shop đổi liền phục vụ rất tốt ạ",5
"chất lượng áo tốt không có gì để chê cả, đánh giá để nhận xu",5
"áo chất lượng phù hợp với giá tiền, shop tư vấn nhiệt tình",5
"giao hàng nhanh, chất lượng vải rất đẹp, mua 3 cái đều ưng",5
"hàng của shop khá là ok, giá vừa rẻ lại không có chỉ thừa",5
"thấy bạn trai mình khen áo đẹp, nên vote 5 sao cho shop",5
"áo chất lượng, giao hàng nhanh, shop tư vấn nhiệt tình",5
"đánh giá mang tính chất nhận xu, áo ok nha mọi người",5
"áo đẹp, gióng hình minh họa, chất lượng vải khá đẹp",5
"áo mặc vùa, chất khá đẹp, màu giống như ảnh chụp",5
"áo đẹp, chuẩn form, chất dày dặn, màu giống hình",5
"shop tư vấn chuẩn size, chất đẹp so với tầm giá",5
"giao hàng nhanh, áo đẹp, chất vải hợp giá tiền",5
"hàng đẹp so với tầm giá, nói chung là hài lòng",5
"áo đẹp lắm form dáng chuẩn, không có chỉ thừa",5
"áo chất dày dặn, đường may cẩn thận đúng form",5
"áo đẹp, đóng gói cẩn thận, giao hàng nhanh",5
"giao hàng nhanh, chất lượng đáng đồng tiền",5
"áo chất lượng ok lắm ạ, hợp với giá tiền",5
"lần đầu mua hàng online, thật sự rất ưng",5
"áo đẹp, chất tốt, nối chung là rẻ mà đẹp",5
"áo đẹp, chất lượng ok, rất ưng cái bụng",5
"chất lượng ok, size chuẩn mặc vừa dáng",5
"chất vải được, áo vừa size, chuẩn from",5
giống như ảnh mô tả măc rất vừa và ok,5
"đường chỉ may đẹp, không có chỉ thừa",5
"chất vải dày dặn, form áo mặc lên ok",5
"giao hàng nhanh, đúng size đúng màu",5
"chất lượng ok, phục vụ nhiệt tình",5
"giao hàng nhanh, chất lượng áo ok",5
"giao hàng nhanh, size áo mặc vừa",5
"mua lần thứ 2, chất lượng rất ok",5
sản phẩm chất lượng như mong đợi,5
"áo đẹp giá tốt, nói chung là ổn",5
áo đẹp đặt lần thứ 2 tặng bạn,5
"Form đẹp, vải ok, màu y hình",5
vải ổn phù hợp với giá tiền,5
"áo đẹp, lần sau ủng hộ tiếp",5
"đã nhận được hàng, rất đẹp",5
"đóng gói cẩn thận, áo đẹp",5
"áo rất đẹp, chất lượn tốt",5
"áo đẹp, size mặc rất vừa",5
"mua lần thứ 2, áo rất ok",5
"đánh giá nhận xu, áo đẹp",5
shop phục vụ nhiệt tình,5
shop tư vấn nhiệt tình,5
"áo đẹp, chất lượng ok",5
áo đẹp rất đáng tiền,5
chất lượng đáng tiền,5
đẹp phù hợp giá tiền,5
"không nói nhiều, OK",5
"áo đẹp, chất vải ok",5
"áo đẹp, chất vải ok",5
chất lượng áo tốt,5
áo đáng tiền mua,5
giao hàng nhanh,5
giao hàng nhanh,5
chất lượng tốt,5
chất lượng ok,5
chất lượng OK,5
rất đáng tiền,5
áo đẹp y hình,5
chất lượng ok,5
chất lượng ok,5
rất đáng tiền,5
rất hài lòng,5
mình rất ưng,5
OK!!!!!!,5
áo đẹp,5
